"geneSet","motif","NES","AUC","TF_highConf","TF_lowConf","nEnrGenes","rankAtMax","enrichedGenes"
"DC_Gen3_Module","factorbook__CREB-ext",6,0.0942,"ATF3 (directAnnotation). ","CREB1 (inferredBy_MotifSimilarity). ",11,871,"ACOX3;ELF4;ERLIN2;MAD2L2;NSMCE2;PHF19;SETD3;SORBS3;SSU72;ZDHHC3;ZFPL1"
"DC_Gen3_Module","taipale_cyt_meth__HSF1_NGAANNTTCNNGAAN_FL_repr",5.89,0.0927,"HSF1 (directAnnotation). ","HOXB2; HSF2; HSF4; HSF5; PPARGC1A (inferredBy_MotifSimilarity). ",8,516,"AMZ2;BCAP31;CDC37;CSK;DNAJA1;HSP90B1;SLC9A6;UBC"
"DC_Gen3_Module","hocomoco__MCR_HUMAN.H11MO.0.D",5.36,0.0859,"NR3C2 (directAnnotation). ","",10,752,"ACACA;CALM1;CCND3;CSK;DEGS1;ELF4;ERLIN2;GDI2;PDIA5;UBC"
"DC_Gen3_Module","transfac_pro__M05332",5.13,0.0828,"SP2 (directAnnotation). ","KLF10; KLF11; KLF6; SP5; SP6; SP7; SP8; SP9 (inferredBy_MotifSimilarity). KLF13; KLF14; KLF2; SP3 (inferredBy_MotifSimilarity_n_Orthology). ",22,4412,"ACACA;AMZ2;AP1S2;ATF4;BCAP31;CALM1;CDC37;CSK;DNAJA1;ELF4;ERLIN2;FAM89A;GDI2;MAD2L2;PAQR4;PDLIM7;PFN1;PHF19;SETD3;SORBS3;UBC;VPS37A"
"DC_Gen3_Module","transfac_pro__M05665",5.07,0.082,"SP3 (inferredBy_Orthology). ","SP2 (inferredBy_MotifSimilarity). SP6 (inferredBy_MotifSimilarity_n_Orthology). ",7,401,"ACACA;ATF4;CALM1;ELF4;MAD2L2;PFN1;VPS37A"
"DC_Gen3_Module","transfac_pro__M05455",5.02,0.0815,"SP6 (inferredBy_Orthology). ","KLF10; KLF11; SP2; SP5; SP7; SP8; SP9 (inferredBy_MotifSimilarity). KLF14; SP3 (inferredBy_MotifSimilarity_n_Orthology). ",7,350,"ACACA;ATF4;CALM1;ELF4;MAD2L2;PFN1;VPS37A"
"DC_Gen3_Module","transfac_pro__M05361",5.02,0.0814,"SP6 (directAnnotation). ","KLF10; KLF6; SP2; SP5; SP8 (inferredBy_MotifSimilarity). KLF2; SP7 (inferredBy_MotifSimilarity_n_Orthology). ",22,4412,"ACACA;AMZ2;AP1S2;ATF4;BCAP31;CALM1;CDC37;CSK;DNAJA1;ELF4;ERLIN2;FAM89A;GDI2;MAD2L2;PAQR4;PDLIM7;PFN1;PGK1;SETD3;SORBS3;UBC;VPS37A"
"DC_Gen3_Module","predrem__nrMotif606",4.91,0.0799,"","",5,150,"CALM1;CSK;ELF4;FAM89A;SORBS3"
"DC_Gen3_Module","taipale_cyt_meth__HSF2_NGAANNTTCNNGAAN_FL",4.88,0.0796,"HSF2 (directAnnotation). ","HOXB2; HSF1; HSF4; HSF5; PPARGC1A (inferredBy_MotifSimilarity). ",8,631,"AMZ2;BCAP31;CDC37;CSK;DNAJA1;HSP90B1;SLC9A6;UBC"
"DC_Gen3_Module","elemento__AGGGCGG",4.75,0.0778,"","",6,296,"ATF4;CALM1;ELF4;PFN1;SORBS3;VPS37A"
"DC_Gen3_Module","transfac_public__M00196",4.73,0.0777,"SP1 (directAnnotation). ","CTCF; EZH2; FOS; IRF1; KLF12; KLF13; KLF14; KLF15; KLF16; KLF2; KLF3; KLF5; KLF9; MAZ; NFYA; NFYB; PBX3; SP2; SP3; SP4; SP8; SP9; STAT1 (inferredBy_MotifSimilarity). KLF17; KLF18; SP6; SP7 (inferredBy_MotifSimilarity_n_Orthology). ",23,4485,"ACACA;BCAP31;CALM1;CCND3;CDC37;CDV3;CFL1;CSK;DNAJA1;ELF4;ERLIN2;ERN1;FAM89A;LOC401052;MAD2L2;PDLIM7;PFN1;PHF19;SETD3;SLC9A6;SORBS3;UBC;ZFPL1"
"DC_Gen3_Module","taipale_cyt_meth__HSF1_NGAANNTTCNNGAAN_eDBD",4.68,0.0769,"HSF1 (directAnnotation). ","HOXB2; HSF2; HSF4; HSF5; PPARGC1A (inferredBy_MotifSimilarity). ",4,57,"CDC37;DNAJA1;HSP90B1;UBC"
"DC_Gen3_Module","transfac_pro__M07854",4.68,0.0769,"HSF1; HSF2; HSF4 (inferredBy_Orthology). ","HOXB2; HSF5 (inferredBy_MotifSimilarity). ",6,316,"AMZ2;CDC37;CSK;DNAJA1;HSP90B1;UBC"
"DC_Gen3_Module","predrem__nrMotif1815",4.63,0.0763,"","",4,95,"CFL1;CSK;SORBS3;ZDHHC3"
"DC_Gen3_Module","taipale__HSF1_full_TTCTAGAANNTTC",4.6,0.0759,"HSF1 (directAnnotation). ","HOXB2; HSF2; HSF4; HSF5 (inferredBy_MotifSimilarity). ",7,363,"AMZ2;BCAP31;CSK;DNAJA1;HSP90B1;SLC9A6;UBC"
"DC_Gen3_Module","transfac_pro__M05391",4.59,0.0758,"KLF2 (inferredBy_Orthology). ","KLF6; KLF7; KLF8; SP2; SP6 (inferredBy_MotifSimilarity). KLF13; SP5 (inferredBy_MotifSimilarity_n_Orthology). ",12,1416,"ACACA;AMZ2;ATF4;CALM1;CDC37;CSK;ELF4;MAD2L2;PDLIM7;PFN1;SETD3;VPS37A"
"DC_Gen3_Module","cisbp__M3926",4.58,0.0756,"SP1 (directAnnotation). ","CTCF; EZH2; FOS; IRF1; KLF12; KLF13; KLF14; KLF15; KLF16; KLF2; KLF3; KLF5; KLF9; MAZ; NFYA; NFYB; PBX3; SP2; SP3; SP4; SP8; SP9; STAT1 (inferredBy_MotifSimilarity). KLF17; KLF18; SP6; SP7 (inferredBy_MotifSimilarity_n_Orthology). ",23,4245,"ACACA;BCAP31;CALM1;CCND3;CDC37;CDV3;CFL1;CSK;DNAJA1;ELF4;ERLIN2;ERN1;FAM89A;LOC401052;MAD2L2;PDLIM7;PFN1;PHF19;SETD3;SLC9A6;SORBS3;UBC;ZFPL1"
"DC_Gen3_Module","transfac_pro__M05301",4.51,0.0747,"KLF6 (inferredBy_Orthology). ","KLF2; KLF8 (inferredBy_MotifSimilarity). ",24,4994,"ACACA;AMZ2;AP1S2;ATF4;BCAP31;CALM1;CDC37;CSK;DNAJA1;ELF4;ERLIN2;ERN1;FAM89A;GDI2;MAD2L2;PAQR4;PDLIM7;PFN1;PGK1;PHF19;SETD3;SORBS3;UBC;VPS37A"
"DC_Gen3_Module","swissregulon__hs__SP1.p2",4.5,0.0745,"SP1 (directAnnotation). ","BRF1; BRF2; CTCF; EGR1; ESRRA; EZH2; FOS; IRF1; KLF12; KLF13; KLF14; KLF15; KLF16; KLF3; KLF5; KLF6; MAZ; NELFE; NFYA; NFYB; PATZ1; PBX3; POLR2A; RBBP5; SMARCA4; SP2; SP3; SP4; SP9; SREBF1 (inferredBy_MotifSimilarity). KLF17; KLF18; SP6; SP7; SP8 (inferredBy_MotifSimilarity_n_Orthology). ",26,4997,"ACACA;ARL6IP5;BCAP31;CCND3;CDC37;CDV3;CFL1;CSK;DEGS1;DNAJA1;ELF4;ERLIN2;ERN1;FAM89A;GDI2;LOC401052;MAD2L2;PARD6A;PDLIM7;PFN1;PHF19;SETD3;SLC9A6;SORBS3;UBC;ZFPL1"
"DC_Gen3_Module","predrem__nrMotif458",4.5,0.0745,"","",8,531,"ACACA;AP1S2;AURKAIP1;CALM1;CSK;ELF4;PDLIM7;SETD3"
"DC_Gen3_Module","transfac_pro__M07855",4.5,0.0745,"HSF1; HSF2; HSF4 (inferredBy_Orthology). ","HOXB2 (inferredBy_MotifSimilarity). ",6,284,"BCAP31;CSK;DNAJA1;HSP90B1;SLC9A6;UBC"
"DC_Gen3_Module","cisbp__M5565",4.5,0.0745,"HSF1 (directAnnotation). ","HOXB2; HSF2; HSF4; HSF5 (inferredBy_MotifSimilarity). ",7,398,"AMZ2;BCAP31;CSK;DNAJA1;HSP90B1;SLC9A6;UBC"
"DC_Gen3_Module","transfac_pro__M05444",4.48,0.0744,"KLF6 (directAnnotation). ","KLF2; KLF7; KLF8; SP2; SP6 (inferredBy_MotifSimilarity). KLF13; SP5 (inferredBy_MotifSimilarity_n_Orthology). ",13,1586,"ACACA;AMZ2;ATF4;CALM1;CDC37;CSK;DNAJA1;ELF4;MAD2L2;PDLIM7;PFN1;SETD3;VPS37A"
"DC_Gen3_Module","hocomoco__HXB2_HUMAN.H11MO.0.D",4.47,0.0742,"HOXB2 (directAnnotation). ","HSF1; HSF2; HSF4 (inferredBy_MotifSimilarity). ",4,84,"CDC37;DNAJA1;HSP90B1;UBC"
"DC_Gen3_Module","cisbp__M5567",4.45,0.0739,"HSF4 (directAnnotation). ","HOXB2; HSF1; HSF2; HSF5 (inferredBy_MotifSimilarity). ",9,763,"AMZ2;BCAP31;CDC37;CSK;DNAJA1;ERLIN2;HSP90B1;SLC9A6;UBC"
"DC_Gen3_Module","taipale_cyt_meth__HSF2_NGAANNTTCNNGAAN_eDBD",4.43,0.0736,"HSF2 (directAnnotation). ","HOXB2; HSF1; HSF4; HSF5 (inferredBy_MotifSimilarity). ",4,66,"CDC37;DNAJA1;HSP90B1;UBC"
"DC_Gen3_Module","taipale__HSF4_DBD_TTCTAGAANNTTC",4.42,0.0735,"HSF4 (directAnnotation). ","HOXB2; HSF1; HSF2; HSF5 (inferredBy_MotifSimilarity). ",9,708,"AMZ2;BCAP31;CDC37;CSK;DNAJA1;ERLIN2;HSP90B1;SLC9A6;UBC"
"DC_Gen3_Module","taipale_cyt_meth__HSF4_NGAANNTTCNNGAAN_eDBD",4.39,0.0731,"HSF4 (directAnnotation). ","HOXB2; HSF1; HSF2; HSF5; PPARGC1A (inferredBy_MotifSimilarity). ",4,50,"CDC37;DNAJA1;HSP90B1;UBC"
"DC_Gen3_Module","transfac_pro__M07615",4.28,0.0717,"SP3 (directAnnotation). ","CTCF; EGR1; EGR2; EGR3; EGR4; EZH2; IRF1; KLF1; KLF12; KLF2; KLF3; KLF5; PAX5; PBX3; POLR2A; SMARCA4; SP1; SP2; SP4; STAT1 (inferredBy_MotifSimilarity). ",21,4085,"ACACA;AMZ2;BCAP31;CALM1;CCND3;CDC37;CFL1;CSK;DNAJA1;ELF4;ERN1;FAM89A;LOC401052;MAD2L2;PDLIM7;PFN1;PHF19;SDHC;SETD3;SLC9A6;SORBS3"
"DC_Gen3_Module","elemento__CGCACGCGC",4.23,0.0711,"","",7,475,"CFL1;DNAJA1;ELF4;PAQR4;PFN1;PREB;THAP7"
"DC_Gen3_Module","hdpi__ELF2",4.23,0.071,"ELF2 (directAnnotation). ","BCLAF1; ELF1; ELF5; ELK1; ELK3; ELK4; ETV1; ETV4; FEV; GABPA; HCFC1; PHF8; SIN3A (inferredBy_MotifSimilarity). ELF4; ERF; ETS2; ETV2; ETV3; ETV3L; ETV5; ETV6; ETV7; FLI1 (inferredBy_MotifSimilarity_n_Orthology). ",10,923,"AP1S2;ATF4;AURKAIP1;BCAP31;CFL1;DNAJA1;FAM89A;PFN1;TATDN3;TTF1"
"DC_Gen3_Module","elemento__CAATTAG",4.21,0.0708,"","",10,1307,"AP1S2;CALM1;CDV3;CSK;ELF4;ERLIN2;GDI2;PHF19;SORBS3;ZDHHC3"
"DC_Gen3_Module","transfac_pro__M05499",4.18,0.0703,"KLF2 (directAnnotation). ","KLF17; KLF6 (inferredBy_MotifSimilarity). ",14,1907,"ACACA;AMZ2;ATF4;CALM1;CDC37;CSK;DNAJA1;ELF4;MAD2L2;PAQR4;PDLIM7;PFN1;SETD3;VPS37A"
"DC_Gen3_Module","transfac_pro__M06315",4.14,0.0699,"ZNF239 (directAnnotation). ","ZNF214 (inferredBy_MotifSimilarity). ",5,277,"ACACA;AMZ2;CDV3;MTHFD2;SORBS3"
"DC_Gen3_Module","swissregulon__sacCer__HSF1",4.13,0.0697,"HSF1; HSF2; HSF4 (inferredBy_Orthology). ","HOXB2 (inferredBy_MotifSimilarity). ",6,479,"AMZ2;CDC37;CMTM7;DNAJA1;ERN1;UBC"
"DC_Gen3_Module","dbcorrdb__ATF3__ENCSR000BPS_1__m3",4.12,0.0696,"ATF3 (directAnnotation). ","",12,1613,"CCND3;CDC37;CSK;DNAJA1;ELF4;ERLIN2;ERN1;MAD2L2;PGLS;SDHC;SLC9A6;UBC"
"DC_Gen3_Module","cisbp__M4093",4.11,0.0694,"","BACH1; BACH2; MAF; MAFA; MAFB; MAFF; MAFG; MAFK; NFE2; NFE2L1; NFE2L2; NFE2L3 (inferredBy_MotifSimilarity). ",7,574,"AP1S2;CALM1;CSK;DNAJA1;ELF4;GDI2;UBC"
"DC_Gen3_Module","hocomoco__HSF4_HUMAN.H11MO.0.D",4.09,0.0692,"HSF4 (directAnnotation). ","HOXB2; HSF1; HSF2 (inferredBy_MotifSimilarity). ",8,769,"AMZ2;BCAP31;CDC37;CSK;DNAJA1;HSP90B1;SLC9A6;UBC"
"DC_Gen3_Module","transfac_pro__M05853",4.09,0.0692,"ZNF548 (directAnnotation). ","",11,862,"CALM1;CSK;DNAJA1;ERLIN2;FAM89A;GDI2;HMGCL;PGK1;SLC9A6;SSU72;VPS37A"
"DC_Gen3_Module","cisbp__M5564",4.09,0.0692,"HSF1 (directAnnotation). ","HOXB2; HSF2; HSF4; HSF5 (inferredBy_MotifSimilarity). ",6,428,"CDC37;CSK;DNAJA1;HSP90B1;SLC9A6;UBC"
"DC_Gen3_Module","cisbp__M0524",4.09,0.0692,"","",7,431,"ACACA;ARL6IP5;CALM1;CSK;ELF4;PGLS;SORBS3"
"DC_Gen3_Module","taipale__HSF1_DBD_TTCTAGAANNTTC_repr",4.08,0.0691,"HSF1 (directAnnotation). ","HOXB2; HSF2; HSF4; HSF5 (inferredBy_MotifSimilarity). ",6,396,"CDC37;CSK;DNAJA1;HSP90B1;SLC9A6;UBC"
"DC_Gen3_Module","cisbp__M1787",4.02,0.0683,"","",5,254,"AURKAIP1;CFL1;ELF4;PFN1;UBC"
"DC_Gen3_Module","transfac_pro__M06792",4.01,0.0681,"ZNF214 (directAnnotation). ","ZNF239 (inferredBy_MotifSimilarity). ",6,355,"ACACA;AMZ2;CDV3;CSK;MTHFD2;SORBS3"
"DC_Gen3_Module","transfac_pro__M04978",4,0.0681,"","",3,30,"ATF4;ELF4;PARD6A"
"DC_Gen3_Module","taipale_tf_pairs__ETV2_RFX5_RNCGGAANNNNNNNNNGCAACN_CAP_repr",3.98,0.0677,"ETV2; RFX5 (directAnnotation). ","",6,428,"CSK;CTSH;ELF4;ERN1;GDI2;SORBS3"
"DC_Gen3_Module","jaspar__MA0516.1",3.98,0.0677,"SP2 (directAnnotation). ","BRF2; CTCF; EGR1; EZH2; FOS; IRF1; KLF12; KLF15; KLF3; KLF5; KLF9; MAZ; NFYA; NFYB; PATZ1; PBX3; SMARCA4; SP1; SP3; SP4; SREBF1; STAT1; SUPT20H (inferredBy_MotifSimilarity). E2F4; SP5; SP6; SP7; SP8; SP9; ZBTB17 (inferredBy_MotifSimilarity_n_Orthology). ",9,787,"BCAP31;CDC37;CFL1;CSK;ELF4;PDLIM7;PFN1;PHF19;SETD3"
"DC_Gen3_Module","dbcorrdb__MAZ__ENCSR000ECL_1__m1",3.97,0.0677,"MAZ (directAnnotation). ","BRF1; BRF2; CEBPB; CTCF; E2F6; EGR1; EZH2; FOS; HDAC2; IRF1; KLF1; KLF3; KLF5; KLF6; MXI1; MYC; NELFE; NFYA; NFYB; PBX3; PGAM2; POLR2A; RAD21; RBBP5; SMARCA4; SP1; SP2; SP3; SP4; SREBF1; SREBF2; STAT1; SUPT20H; TAF1; UBTF; XRCC4; ZBTB7B; ZMIZ1; ZNF274 (inferredBy_MotifSimilarity). ",11,1249,"ARL6IP5;BCAP31;CDC37;CFL1;CSK;ELF4;MAD2L2;PDLIM7;PFN1;SETD3;SORBS3"
"DC_Gen3_Module","taipale_cyt_meth__HSF1_NGAANNTTCYRGAAN_eDBD_meth",3.95,0.0673,"HSF1 (directAnnotation). ","HOXB2; HSF2; HSF4; HSF5 (inferredBy_MotifSimilarity). ",12,2018,"AMZ2;AP1S2;BCAP31;CDC37;CSK;DNAJA1;ELF4;ERLIN2;ERN1;HSP90B1;SLC9A6;UBC"
"DC_Gen3_Module","taipale_cyt_meth__MEF2C_CCWWATWWRG_FL_meth_repr",3.94,0.0672,"MEF2C (directAnnotation). ","MEF2B; MEF2D (inferredBy_MotifSimilarity). SRF (inferredBy_MotifSimilarity_n_Orthology). ",6,428,"CALM1;CFL1;CMTM7;PDLIM7;PFN1;SORBS3"
"DC_Gen3_Module","transfac_pro__M06132",3.91,0.0669,"ZNF823 (directAnnotation). ","",5,274,"CSK;ELF4;ERN1;PDLIM7;SORBS3"
"DC_Gen3_Module","taipale_cyt_meth__ZNF524_NYTCGNACCCKN_FL_repr",3.91,0.0669,"ZNF524 (directAnnotation). ","",3,74,"CSK;ELF4;UBC"
"DC_Gen3_Module","transfac_pro__M03806",3.91,0.0668,"ZBTB7C (directAnnotation). ","",5,224,"ACACA;ARL6IP5;CSK;ELF4;UBC"
"DC_Gen3_Module","taipale_cyt_meth__ELF3_ACCCGGAAGNNNNNNNNNWWWWW_FL",3.87,0.0663,"ELF3 (directAnnotation). ","EHF; ELF1; ELF2; ELF4; ELF5; FLI1; NR2C2 (inferredBy_MotifSimilarity). ERF; ETV3; ETV3L (inferredBy_MotifSimilarity_n_Orthology). ",9,830,"ACACA;AP1S2;CCND3;CDV3;CSK;SORBS3;SSU72;UBC;ZDHHC3"
"DC_Gen3_Module","taipale_cyt_meth__MEF2D_CCWWATWWRG_eDBD_meth",3.86,0.0662,"MEF2D (directAnnotation). ","MEF2B; MEF2C (inferredBy_MotifSimilarity). SRF (inferredBy_MotifSimilarity_n_Orthology). ",5,256,"CALM1;CFL1;CMTM7;PDLIM7;PFN1"
"DC_Gen3_Module","elemento__AATTAGCA",3.86,0.0661,"","",5,294,"AP1S2;CSK;ELF4;PFN1;ZDHHC3"
"DC_Gen3_Module","cisbp__M6213",3.86,0.0661,"ERG (directAnnotation). ","ELK1; ELK3; ELK4; ETS1; ETV3; FLI1; GABPB1 (inferredBy_MotifSimilarity). ERF; ETV1; ETV2; ETV3L; ETV4; ETV5; ETV6; ETV7; GABPA (inferredBy_MotifSimilarity_n_Orthology). ",6,507,"AURKAIP1;CDC37;CSK;PDLIM7;PFN1;TTF1"
"DC_Gen3_Module","transfac_pro__M04626",3.85,0.066,"PROP1 (directAnnotation). ","",6,443,"AP1S2;CSK;ELF4;PFN1;PHF19;SORBS3"
"DC_Gen3_Module","hocomoco__HSF2_HUMAN.H11MO.0.A",3.84,0.0659,"HSF2 (directAnnotation). ","HOXB2; HSF1; HSF4 (inferredBy_MotifSimilarity). ",4,153,"CDC37;CSK;DNAJA1;UBC"
"DC_Gen3_Module","transfac_public__M00035",3.83,0.0657,"","BACH1; BACH2; MAF; MAFA; MAFB; MAFF; MAFG; MAFK; NFE2; NFE2L1; NFE2L2; NFE2L3 (inferredBy_MotifSimilarity). ",7,558,"AP1S2;CALM1;CSK;DNAJA1;ELF4;GDI2;UBC"
"DC_Gen3_Module","dbcorrdb__EBF1__ENCSR000DZQ_1__m1",3.81,0.0656,"EBF1 (directAnnotation). ","EBF2; EBF3 (inferredBy_MotifSimilarity). EBF4 (inferredBy_MotifSimilarity_n_Orthology). ",4,112,"CSK;ELF4;MAD2L2;SORBS3"
"DC_Gen3_Module","transfac_pro__M00931",3.8,0.0654,"SP1; SP3; SP4 (directAnnotation). ","FOS; IRF1; KLF1; KLF12; KLF15; KLF3; KLF4; KLF5; KLF6; NFYA; NFYB; PBX3; SP2; STAT1 (inferredBy_MotifSimilarity). SP6; SP7; SP8; SP9 (inferredBy_MotifSimilarity_n_Orthology). ",16,2632,"ACACA;BCAP31;CALM1;CCND3;CDC37;CFL1;CSK;ELF4;ERN1;FAM89A;MAD2L2;PDLIM7;PFN1;PHF19;SETD3;SORBS3"
"DC_Gen3_Module","cisbp__M6207",3.79,0.0653,"ELK1 (directAnnotation). ","BCLAF1; ELF1; ELF2; ELF4; ELK3; ELK4; ERF; ERG; ETS1; ETS2; ETV1; ETV2; ETV3; ETV4; ETV5; FEV; FLI1; GABPA; GABPB1; SRF (inferredBy_MotifSimilarity). ETV3L; ETV6; ETV7 (inferredBy_MotifSimilarity_n_Orthology). ",18,2799,"AP1S2;ATF4;AURKAIP1;CCND3;CDC37;CFL1;CSK;DNAJA1;ELF4;ERLIN2;FAM89A;PDLIM7;PFN1;SDHC;SORBS3;TTF1;UBC;ZDHHC3"
"DC_Gen3_Module","taipale_cyt_meth__MEF2D_CCWWATWWRG_eDBD",3.79,0.0653,"MEF2D (directAnnotation). ","MEF2B; MEF2C; SRF (inferredBy_MotifSimilarity). ",4,135,"CFL1;CMTM7;PDLIM7;PFN1"
"DC_Gen3_Module","neph__UW.Motif.0669",3.78,0.0652,"","",16,2668,"ACACA;AMZ2;CALM1;CCND3;CDC37;CSK;DNAJA1;ELF4;ERLIN2;ERN1;FAM103A1;GDI2;MAD2L2;NFKBIB;PHF19;UBC"
"DC_Gen3_Module","factorbook__A-Box",3.77,0.065,"BDP1; BRF1; BRF2 (directAnnotation). ","ATF3; GTF3C2; POLR3A; POLR3G; TBL1XR1; TBP (inferredBy_MotifSimilarity). ",13,981,"ACACA;AMZ2;CALM1;CCND3;CSK;ELF4;FAM103A1;GDI2;MAD2L2;MTHFD2;PDIA5;TTF1;UBC"
"DC_Gen3_Module","cisbp__M6287",3.76,0.0649,"HSF2 (directAnnotation). ","HOXB2; HSF1; HSF4 (inferredBy_MotifSimilarity). ",4,168,"CDC37;CSK;DNAJA1;UBC"
"DC_Gen3_Module","transfac_pro__M05386",3.76,0.0648,"KLF17 (directAnnotation). ","KLF2 (inferredBy_MotifSimilarity). ",14,1711,"ACACA;AMZ2;ATF4;CALM1;CDC37;CSK;DNAJA1;ELF4;MAD2L2;PAQR4;PDLIM7;PFN1;SETD3;VPS37A"
"DC_Gen3_Module","dbcorrdb__POLR2A__ENCSR000EAY_1__m1",3.75,0.0647,"POLR2A (directAnnotation). ","BCLAF1; BRF1; E2F1; E2F6; ELF1; ELK1; ELK4; ETS1; ETV1; EZH2; GABPA; GABPB1; GTF2F1; HCFC1; MAX; MXI1; NR2C2; PHF8; PML; SIN3A; SMARCA4; TAF1; XRCC4; ZMIZ1; ZNF274 (inferredBy_MotifSimilarity). ERG; FLI1 (inferredBy_MotifSimilarity_n_Orthology). ",20,3948,"ACACA;AMZ2;AP1S2;ATF4;AURKAIP1;BCAP31;CDC37;CFL1;CSK;DNAJA1;ELF4;FAM103A1;FAM89A;NFKBIB;PFN1;PREB;SSU72;TTF1;UBC;ZFPL1"
"DC_Gen3_Module","predrem__nrMotif2096",3.74,0.0647,"","KLF3; KLF6 (inferredBy_MotifSimilarity). ",12,1877,"ATF4;CCND3;CSK;DNAJA1;ELF4;ERN1;FAM89A;GDI2;PFN1;SORBS3;UBC;ZFPL1"
"DC_Gen3_Module","transfac_pro__M07395",3.73,0.0645,"SP1 (directAnnotation). ","CTCF; EGR1; EZH2; FOS; IRF1; KLF12; KLF15; KLF16; KLF3; KLF5; NFYA; NFYB; PBX3; SP2; SP3; SP4; STAT1; TEAD2; WT1 (inferredBy_MotifSimilarity). SP6; SP7; SP8; SP9 (inferredBy_MotifSimilarity_n_Orthology). ",13,1514,"ACACA;BCAP31;CALM1;CDC37;CFL1;CSK;DNAJA1;ELF4;MAD2L2;PDLIM7;PFN1;SETD3;SORBS3"
"DC_Gen3_Module","hdpi__ETV4",3.72,0.0644,"ETV4 (directAnnotation). ","ELF1; ELF5; ELK1; ELK3; ELK4; ETV1; ETV5; FEV; GABPA (inferredBy_MotifSimilarity). ELF2; ELF4; ERF; ETS2; ETV2; ETV3; ETV3L; ETV6; ETV7; FLI1 (inferredBy_MotifSimilarity_n_Orthology). ",6,507,"AP1S2;AURKAIP1;BCAP31;CFL1;PFN1;TTF1"
"DC_Gen3_Module","taipale_cyt_meth__ELF3_ACCCGGAAGNNNNNNNNNWWWWW_eDBD",3.7,0.0641,"ELF3 (directAnnotation). ","EHF; ELF1; ELF2; ELF4; ELF5; FLI1 (inferredBy_MotifSimilarity). ",5,294,"AP1S2;CCND3;CDV3;UBC;ZDHHC3"
"DC_Gen3_Module","flyfactorsurvey__Ets65A_SANGER_10_FBgn0005658",3.7,0.0641,"FEV (inferredBy_Orthology). ","ELF1; ELF2; ELF4; ELK4; ERF; ERG; ETS1; ETV1; ETV2; FLI1; GABPA (inferredBy_MotifSimilarity). ELK3; ETS2; ETV3; ETV3L (inferredBy_MotifSimilarity_n_Orthology). ",15,2331,"AP1S2;ATF4;AURKAIP1;BCAP31;CCND3;CDC37;CFL1;CPSF3L;CSK;DNAJA1;FAM89A;PDIA5;PFN1;SORBS3;TTF1"
"DC_Gen3_Module","transfac_pro__M01244",3.68,0.0639,"HSF2 (directAnnotation). ","HOXB2; HSF1; HSF4; HSF5 (inferredBy_MotifSimilarity). ",6,374,"AMZ2;BCAP31;DNAJA1;HSP90B1;SLC9A6;UBC"
"DC_Gen3_Module","taipale_cyt_meth__HSF1_NGAANNTTCYRGAAN_FL_meth",3.68,0.0639,"HSF1 (directAnnotation). ","HOXB2; HSF2; HSF4; HSF5 (inferredBy_MotifSimilarity). ",5,295,"CDC37;CSK;DNAJA1;SLC9A6;UBC"
"DC_Gen3_Module","flyfactorsurvey__Ets21c_SANGER_5_FBgn0005660",3.68,0.0638,"ERF; ETV3; ETV3L (inferredBy_Orthology). ","ELK1; ELK3; ELK4; ERG; ETS1; ETS2; ETV1; ETV2; ETV4; ETV5; FEV; FLI1; GABPA (inferredBy_MotifSimilarity). ETV6; ETV7 (inferredBy_MotifSimilarity_n_Orthology). ",5,362,"AURKAIP1;CFL1;CSK;PFN1;TTF1"
"DC_Gen3_Module","taipale__IRF3_full_NNRRAAAGGAAACCGAAACTN_repr",3.66,0.0636,"IRF3 (directAnnotation). ","IRF1; IRF2; IRF4; IRF5; IRF7; IRF8; IRF9; STAT1; STAT2 (inferredBy_MotifSimilarity). ",6,428,"ARL6IP5;CCND3;CSK;DNAJA1;ELF4;SORBS3"
"DC_Gen3_Module","taipale_cyt_meth__FLI1_NACCGGAARTN_eDBD",3.65,0.0634,"FLI1 (directAnnotation). ","BCLAF1; ELF1; ELK1; ELK3; ELK4; ERF; ERG; ETS1; ETS2; ETV1; ETV2; ETV3; ETV4; ETV5; FEV; GABPA; GABPB1; SRF (inferredBy_MotifSimilarity). ETV3L; ETV6; ETV7 (inferredBy_MotifSimilarity_n_Orthology). ",10,1076,"AP1S2;ATF4;AURKAIP1;BCAP31;CFL1;CPSF3L;CSK;PDLIM7;PFN1;TTF1"
"DC_Gen3_Module","transfac_pro__M07853",3.64,0.0633,"HSF1; HSF2; HSF4 (inferredBy_Orthology). ","HOXB2 (inferredBy_MotifSimilarity). ",7,677,"AMZ2;AP1S2;CDC37;CSK;DNAJA1;HSP90B1;UBC"
"DC_Gen3_Module","taipale_tf_pairs__MYBL1_EOMES_NNSYGNCNAACNNNNNNCACRCNN_CAP_repr",3.62,0.0631,"EOMES; MYBL1 (directAnnotation). ","",5,331,"CCND3;ELF4;PDIA5;PGK1;SETD3"
"DC_Gen3_Module","predrem__nrMotif2009",3.61,0.0629,"","",5,259,"AMZ2;DNAJA1;ELF4;GDI2;VPS37A"
"DC_Gen3_Module","dbcorrdb__PBX3__ENCSR000BGR_1__m3",3.59,0.0627,"PBX3 (directAnnotation). ","BRF1; BRF2; CTCF; CUX1; EGR1; EGR2; EGR3; EGR4; ESRRA; FOS; HDAC2; IRF1; KLF1; KLF12; KLF14; KLF15; KLF3; KLF5; KLF6; KLF9; MAZ; NELFE; NFYA; NFYB; PATZ1; RAD21; RBBP5; RCOR1; REST; SMARCA4; SP1; SP2; SP3; SP4; SREBF1; SREBF2; STAT1; SUPT20H; TBX15; WT1; XRCC4; ZBTB7B (inferredBy_MotifSimilarity). E2F4; KLF17; KLF18; SP5; SP6; SP7; SP8; SP9 (inferredBy_MotifSimilarity_n_Orthology). ",16,2429,"ACACA;BCAP31;CDC37;CDV3;CFL1;CSK;ELF4;ERN1;GDI2;MAD2L2;MOSPD3;PDLIM7;PFN1;PHF19;SETD3;ZFPL1"
"DC_Gen3_Module","cisbp__M5975",3.57,0.0624,"ZNF524 (directAnnotation). ","",5,350,"ACACA;CSK;ELF4;ERN1;UBC"
"DC_Gen3_Module","transfac_pro__M00932",3.57,0.0623,"SP1; SP2; SP3; SP4 (directAnnotation). ","FOS; IRF1; KLF12; KLF13; KLF14; KLF15; KLF16; KLF2; KLF3; KLF4; KLF5; KLF9; MAZ; NFYA; NFYB; PATZ1; PBX3; SP8; SP9; STAT1 (inferredBy_MotifSimilarity). KLF17; KLF18; SP6; SP7 (inferredBy_MotifSimilarity_n_Orthology). ",11,1110,"BCAP31;CDC37;CFL1;CSK;ELF4;MAD2L2;PDLIM7;PFN1;PHF19;SETD3;SORBS3"
"DC_Gen3_Module","taipale_cyt_meth__ZNF281_NCCCCTCCCCCN_eDBD_meth",3.56,0.0623,"ZNF281 (directAnnotation). ","SP1; SP4 (inferredBy_MotifSimilarity). ",8,739,"BCAP31;CDC37;CFL1;DNAJA1;ELF4;PDLIM7;PFN1;UBC"
"DC_Gen3_Module","taipale_cyt_meth__ERG_NACCGGAARYN_eDBD",3.56,0.0623,"ERG (directAnnotation). ","BCLAF1; ELF1; ELF2; ELK1; ELK3; ELK4; ERF; ETS1; ETS2; ETV1; ETV2; ETV3; ETV4; ETV5; ETV6; FEV; FLI1; GABPA; GABPB1; GATA2; POLR2A; SRF (inferredBy_MotifSimilarity). ELF4; ETV3L; ETV7 (inferredBy_MotifSimilarity_n_Orthology). ",14,2137,"AMZ2;AP1S2;ATF4;AURKAIP1;BCAP31;CDC37;CFL1;CPSF3L;CSK;FAM89A;PDLIM7;PFN1;TTF1;UBC"
"DC_Gen3_Module","cisbp__M0695",3.55,0.0621,"ELK1 (inferredBy_Orthology). ","BCLAF1; ELF1; ELF2; ELF4; ELK3; ELK4; ERF; ERG; ETS1; ETS2; ETV1; ETV2; ETV3; ETV4; ETV5; ETV6; FEV; FLI1; GABPA; GABPB1; SRF (inferredBy_MotifSimilarity). ETV3L; ETV7 (inferredBy_MotifSimilarity_n_Orthology). ",23,4452,"AMZ2;AP1S2;ATF4;AURKAIP1;BCAP31;CCND3;CDC37;CFL1;CPSF3L;CSK;DNAJA1;ELF4;ERN1;FAM89A;GDI2;PDLIM7;PFN1;PGK1;SDHC;TATDN3;TTF1;UBC;ZDHHC3"
"DC_Gen3_Module","transfac_pro__M01304",3.55,0.0621,"SRF (directAnnotation). ","",3,31,"CFL1;PDLIM7;PFN1"
"DC_Gen3_Module","predrem__nrMotif2069",3.55,0.0621,"","",5,353,"AP1S2;ARL6IP5;CCND3;CMTM7;FAM103A1"
"DC_Gen3_Module","dbcorrdb__FOSL1__ENCSR000BNS_1__m1",3.54,0.062,"FOSL1 (directAnnotation). ","",20,4017,"AMZ2;AP1S2;BCAP31;CCND3;CDC37;CDV3;CMTM7;CSK;CTSH;DNAJA1;ELF4;ERLIN2;GDI2;MAD2L2;MOSPD3;NFKBIB;PDLIM7;PFN1;SDHC;SORBS3"
"DC_Gen3_Module","taipale_tf_pairs__TFAP2C_MAX_TNSCCNNNGGSNNNCACGTGN_CAP_repr",3.54,0.062,"MAX; TFAP2C (directAnnotation). ","",3,78,"CSK;ERLIN2;HSP90B1"
"DC_Gen3_Module","transfac_pro__M01167",3.53,0.0619,"ELK4 (directAnnotation). ","BCLAF1; ELF1; ELK1; ELK3; ERF; ERG; ETS1; ETS2; ETV1; ETV2; ETV3; ETV4; ETV5; ETV6; FEV; FLI1; GABPA; GABPB1; SRF; TAF1 (inferredBy_MotifSimilarity). ETV3L; ETV7 (inferredBy_MotifSimilarity_n_Orthology). ",9,981,"AP1S2;ATF4;AURKAIP1;BCAP31;CFL1;CSK;ERN1;PFN1;TTF1"
"DC_Gen3_Module","cisbp__M5572",3.53,0.0618,"IRF3 (directAnnotation). ","IRF1; IRF2; IRF4; IRF5; IRF7; IRF8; IRF9; STAT1; STAT2 (inferredBy_MotifSimilarity). ",6,459,"ARL6IP5;CCND3;CSK;DNAJA1;ELF4;SORBS3"
"DC_Gen3_Module","transfac_pro__M07702",3.53,0.0618,"FEV (inferredBy_Orthology). ","BCLAF1; EGR1; ELF1; ELK1; ELK3; ELK4; ERF; ERG; ETS1; ETS2; ETV1; ETV2; ETV3; ETV4; ETV5; FLI1; GABPA; GABPB1; POLR2A; SRF (inferredBy_MotifSimilarity). ETV3L; ETV6; ETV7 (inferredBy_MotifSimilarity_n_Orthology). ",9,1053,"AP1S2;ATF4;AURKAIP1;BCAP31;CFL1;CSK;FAM89A;PFN1;TTF1"
"DC_Gen3_Module","hocomoco__SP1_HUMAN.H11MO.0.A",3.52,0.0618,"SP1 (directAnnotation). ","BRF1; BRF2; CEBPB; CTCF; CUX1; EGR1; EGR2; EGR3; EGR4; ESRRA; EZH2; HDAC2; IRF1; KLF1; KLF10; KLF11; KLF12; KLF14; KLF15; KLF16; KLF3; KLF5; KLF6; MAX; MAZ; MXI1; NELFE; NFYA; NFYB; PATZ1; PBX3; POLR2A; RAD21; RBBP5; RCOR1; REST; SMARCA4; SP2; SP3; SP4; SP9; SREBF1; SREBF2; STAT1; SUPT20H; VEZF1; WT1; XRCC4; ZBTB7B; ZMIZ1; ZNF274; ZNF467 (inferredBy_MotifSimilarity). KLF17; KLF18; SP5; SP6; SP7; SP8; ZBTB17 (inferredBy_MotifSimilarity_n_Orthology). ",13,2196,"ACACA;BCAP31;CDC37;CSK;ELF4;ERN1;FAM89A;MAD2L2;PDLIM7;PFN1;PHF19;SETD3;SLC9A6"
"DC_Gen3_Module","transfac_pro__M03893",3.51,0.0616,"WT1 (directAnnotation). ","CTCF; EGR1; EGR2; ESRRA; HDAC2; NELFE; PATZ1; SMARCA4; SP1; SP2; SP3; SP4; SREBF1; TEAD2; XRCC4 (inferredBy_MotifSimilarity). EGR3; EGR4 (inferredBy_MotifSimilarity_n_Orthology). ",12,1514,"BCAP31;CCND3;CDC37;CFL1;DNAJA1;ELF4;FAM89A;GDI2;MAD2L2;PDLIM7;PFN1;SETD3"
"DC_Gen3_Module","transfac_pro__M06960",3.51,0.0616,"","",6,525,"ARL6IP5;CMTM7;CSK;ELF4;PDLIM7;PHF19"
"DC_Gen3_Module","taipale_cyt_meth__FLI1_NACMGGAARTN_FL_meth",3.51,0.0615,"FLI1 (directAnnotation). ","BCLAF1; ELF1; ELK1; ELK3; ELK4; ERF; ERG; ETS1; ETS2; ETV1; ETV2; ETV3; ETV4; ETV5; FEV; GABPA; GABPB1; SRF (inferredBy_MotifSimilarity). ETV3L; ETV6; ETV7 (inferredBy_MotifSimilarity_n_Orthology). ",5,286,"AURKAIP1;CSK;PDLIM7;PFN1;TTF1"
"DC_Gen3_Module","taipale__ZNF524_full_CTCGRACCCGTGCN_repr",3.5,0.0614,"ZNF524 (directAnnotation). ","",5,377,"ACACA;CSK;ELF4;ERN1;UBC"
"DC_Gen3_Module","hocomoco__SP2_HUMAN.H11MO.0.A",3.49,0.0613,"SP2 (directAnnotation). ","BRF1; BRF2; CEBPB; CTCF; CUX1; E2F6; EGR1; EGR2; EGR3; EGR4; ELF1; ESRRA; EZH2; FOS; HDAC2; IRF1; KLF1; KLF15; KLF16; KLF3; KLF5; KLF6; KLF9; MAX; MAZ; MXI1; MYC; NELFE; NFYA; NFYB; PATZ1; PBX3; PHF8; POLR2A; RAD21; RBBP5; RCOR1; REST; SMARCA4; SP1; SP3; SP4; SREBF1; SREBF2; STAT1; SUPT20H; TBX15; VEZF1; WT1; XRCC4; ZBTB7A; ZBTB7B; ZMIZ1; ZNF274; ZNF467 (inferredBy_MotifSimilarity). KLF17; KLF18; SP5; SP6; SP7; SP8; SP9; ZBTB17 (inferredBy_MotifSimilarity_n_Orthology). ",16,2397,"ACACA;BCAP31;CALM1;CCND3;CDC37;CFL1;CSK;DNAJA1;ELF4;ERN1;MAD2L2;PDLIM7;PFN1;PHF19;SETD3;SORBS3"
"DC_Gen3_Module","cisbp__M5431",3.49,0.0613,"FLI1 (directAnnotation). ","BCLAF1; ELF1; ELK1; ELK3; ELK4; ERF; ERG; ETS1; ETS2; ETV1; ETV2; ETV3; ETV4; ETV5; FEV; GABPA; GABPB1; SRF (inferredBy_MotifSimilarity). ETV3L; ETV6; ETV7 (inferredBy_MotifSimilarity_n_Orthology). ",11,1613,"AP1S2;ATF4;AURKAIP1;BCAP31;CDC37;CFL1;CPSF3L;CSK;PDLIM7;PFN1;TTF1"
"DC_Gen3_Module","transfac_pro__M05407",3.49,0.0613,"KLF17 (inferredBy_Orthology). ","",13,1353,"ACACA;AMZ2;ATF4;CALM1;CDC37;CSK;ELF4;MAD2L2;PAQR4;PDLIM7;PFN1;SETD3;VPS37A"
"DC_Gen3_Module","cisbp__M5566",3.48,0.0612,"HSF2 (directAnnotation). ","HOXB2; HSF1; HSF4; HSF5 (inferredBy_MotifSimilarity). ",9,962,"AMZ2;AP1S2;BCAP31;CSK;DNAJA1;ERLIN2;HSP90B1;SLC9A6;UBC"
"DC_Gen3_Module","transfac_pro__M04693",3.47,0.0611,"FOS (directAnnotation). ","ATF3; BACH2; BATF; FOSB; FOSL1; FOSL2; GATA2; JDP2; JUN; JUNB; JUND; MEF2C; NFATC1; NFE2; TCF7L2; TRIM28 (inferredBy_MotifSimilarity). ",5,296,"ELF4;PFN1;SLC9A6;UBC;ZDHHC3"
"DC_Gen3_Module","taipale_cyt_meth__MEF2C_CCWWATWWRG_FL",3.46,0.0609,"MEF2C (directAnnotation). ","MEF2B; MEF2D; SRF (inferredBy_MotifSimilarity). ",4,118,"CFL1;CMTM7;PDLIM7;PFN1"
"DC_Gen3_Module","transfac_pro__M07063",3.45,0.0608,"SP1 (directAnnotation). ","CTCF; FOS; IRF1; KLF12; KLF3; KLF5; KLF6; NFYA; NFYB; PBX3; SP2; SP3; SP4; STAT1 (inferredBy_MotifSimilarity). ",14,1732,"ACACA;BCAP31;CCND3;CDC37;CFL1;CSK;ELF4;FAM89A;MAD2L2;PDLIM7;PFN1;PHF19;SETD3;SORBS3"
