"geneSet","motif","NES","AUC","TF_highConf","TF_lowConf","nEnrGenes","rankAtMax","enrichedGenes"
"DC_Gen3_Module","cisbp__M0690",3.05,0.0556,"ETV1 (inferredBy_Orthology). ","BCLAF1; ELF1; ELF2; ELF4; ELK1; ELK3; ELK4; ERF; ERG; ETS1; ETS2; ETV2; ETV3; ETV4; ETV5; FEV; FLI1; GABPA; GABPB1; SRF (inferredBy_MotifSimilarity). ETV3L; ETV6; ETV7 (inferredBy_MotifSimilarity_n_Orthology). ",3,78,"AURKAIP1;CFL1;PFN1"
"DC_Gen3_Module","transfac_pro__M05871",3.05,0.0556,"ZNF565 (directAnnotation). ","",6,492,"CSK;GDI2;MAD2L2;SORBS3;UBC;ZDHHC3"
"DC_Gen3_Module","cisbp__M4539",3.05,0.0556,"ELK4 (directAnnotation). ","BCLAF1; EGR1; ELF1; ELF2; ELF4; ELK1; ELK3; ERF; ERG; ETS1; ETV1; ETV2; ETV3; ETV4; ETV5; FEV; FLI1; GABPA; GABPB1; HCFC1; PHF8; POLR2A; SIN3A; SRF; TAF1 (inferredBy_MotifSimilarity). ETS2; ETV3L; ETV6; ETV7 (inferredBy_MotifSimilarity_n_Orthology). ",20,4338,"AP1S2;ATF4;AURKAIP1;BCAP31;CCND3;CDC37;CFL1;CPSF3L;CSK;DNAJA1;ELF4;ERLIN2;ERN1;FAM89A;PDLIM7;PFN1;SSU72;TTF1;UBC;ZDHHC3"
"DC_Gen3_Module","hocomoco__ZBT17_MOUSE.H11MO.0.A",3.05,0.0556,"ZBTB17 (inferredBy_Orthology). ","BRF1; BRF2; CUX1; EGR1; EGR2; EGR3; EGR4; EZH2; FOS; HDAC2; KAT2A; KLF15; KLF16; MAZ; NELFE; PATZ1; RBBP5; RCOR1; REST; SMARCA4; SP1; SP2; SP3; SP4; SREBF1; SREBF2; SUPT20H; VEZF1; WT1; XRCC4; ZBTB7B; ZNF148; ZNF263; ZNF281; ZNF444; ZNF467 (inferredBy_MotifSimilarity). SP5 (inferredBy_MotifSimilarity_n_Orthology). ",8,752,"BCAP31;CDC37;CFL1;CSK;DNAJA1;ELF4;PFN1;SORBS3"
"DC_Gen3_Module","dbcorrdb__EZH2__ENCSR000ATC_1__m4",3.05,0.0555,"EZH2 (directAnnotation). ","",6,454,"CCND3;CSK;DNAJA1;ELF4;ERLIN2;SORBS3"
"DC_Gen3_Module","cisbp__M4953",3.05,0.0555,"ERG (inferredBy_Orthology). ","BCLAF1; ELF1; ELK1; ELK3; ELK4; ERF; ETS1; ETS2; ETV1; ETV2; ETV3; ETV4; ETV5; FEV; FLI1; GABPA; GABPB1; SRF (inferredBy_MotifSimilarity). ELF2; ELF4; ETV3L; ETV6; ETV7 (inferredBy_MotifSimilarity_n_Orthology). ",17,3042,"AP1S2;ATF4;AURKAIP1;BCAP31;CDC37;CFL1;CPSF3L;CSK;DNAJA1;ELF4;ERN1;FAM89A;GDI2;PFN1;SORBS3;TTF1;UBC"
"DC_Gen3_Module","transfac_pro__M01725",3.04,0.0555,"NR2C2 (directAnnotation). ","ESRRA; NR2F1; NR2F2; PPARG; RXRA (inferredBy_MotifSimilarity). NR1H3; PPARA (inferredBy_MotifSimilarity_n_Orthology). ",5,371,"CCND3;CSK;ERN1;PFN1;SORBS3"
"DC_Gen3_Module","taipale_cyt_meth__TEF_NRTTAYGTAAYN_eDBD_meth",3.04,0.0555,"TEF (directAnnotation). ","ATF2; CEBPB; CEBPD; CEBPE; CEBPG; DBP; HLF; NFIL3 (inferredBy_MotifSimilarity). ",4,199,"AP1S2;CALM1;PGK1;SORBS3"
"DC_Gen3_Module","predrem__nrMotif343",3.04,0.0555,"","",4,165,"CSK;GDI2;SDHC;SORBS3"
"DC_Gen3_Module","cisbp__M0698",3.04,0.0554,"ETV5 (inferredBy_Orthology). ","BCLAF1; ELF1; ELF2; ELF4; ELK1; ELK3; ELK4; ERF; ERG; ETS1; ETS2; ETV1; ETV2; ETV3; ETV4; FEV; FLI1; GABPA; GABPB1; SRF (inferredBy_MotifSimilarity). ETV3L; ETV6; ETV7 (inferredBy_MotifSimilarity_n_Orthology). ",18,3217,"AMZ2;AP1S2;ATF4;AURKAIP1;BCAP31;CDC37;CFL1;CPSF3L;CSK;DNAJA1;ERLIN2;FAM89A;PDLIM7;PFN1;SDHC;SORBS3;TTF1;UBC"
"DC_Gen3_Module","cisbp__M4460",3.04,0.0554,"ELF1 (directAnnotation). ","BCLAF1; EGR1; EHF; ELF2; ELF3; ELF4; ELF5; ELK1; ELK3; ELK4; ETS1; ETV6; GABPA; GABPB1; HCFC1; NR2C2; PHF8; PML; POLR2A; SIN3A; TAF1 (inferredBy_MotifSimilarity). ERF; ETV3; ETV3L; FLI1 (inferredBy_MotifSimilarity_n_Orthology). ",14,1898,"AP1S2;AURKAIP1;BCAP31;CFL1;CSK;CTSH;DNAJA1;ELF4;PFN1;SORBS3;TTF1;UBC;ZDHHC3;ZFPL1"
"DC_Gen3_Module","transfac_pro__M02891",3.03,0.0553,"RARA (inferredBy_Orthology). ","",5,428,"CSK;ELF4;MAD2L2;SETD3;SORBS3"
"DC_Gen3_Module","taipale_cyt_meth__ERG_NACMGGAARTN_FL_meth",3.03,0.0553,"ERG (directAnnotation). ","ELF1; ELK1; ELK3; ELK4; ERF; ETS1; ETS2; ETV1; ETV2; ETV3; ETV4; ETV5; FEV; FLI1; GABPA; GABPB1; GATA2; SRF (inferredBy_MotifSimilarity). ELF2; ELF4; ETV3L; ETV6; ETV7 (inferredBy_MotifSimilarity_n_Orthology). ",6,553,"AURKAIP1;CDC37;CSK;PDLIM7;PFN1;TTF1"
"DC_Gen3_Module","taipale__ETV6_full_CCGGAASCGGAAGTN_repr",3.03,0.0553,"ETV6 (directAnnotation). ","BCLAF1; ELF1; ELF2; ELF5; ELK1; ELK3; ELK4; ERF; ERG; ETS1; ETS2; ETV1; ETV2; ETV3; ETV4; ETV5; FEV; FLI1; GABPA; HCFC1; IRF1; PHF8; PML; POLR2A; RELA; TAF1 (inferredBy_MotifSimilarity). ELF4 (inferredBy_MotifSimilarity_n_Orthology). ",20,4043,"ACACA;AMZ2;ATF4;BCAP31;CCND3;CDC37;CMTM7;CSK;CTSH;ELF4;FAM103A1;GDI2;MAD2L2;PDLIM7;PFN1;SORBS3;SSU72;TTF1;UBC;VPS37A"
"DC_Gen3_Module","transfac_pro__M07595",3.02,0.0552,"","",5,473,"CALM1;CMTM7;CSK;ELF4;UBC"
"DC_Gen3_Module","taipale_cyt_meth__FOXP3_NAWTTGTAYGACAAATN_FL",3.02,0.0552,"FOXP3 (directAnnotation). ","",5,353,"AP1S2;CPSF3L;ERLIN2;PDIA5;TTF1"
"DC_Gen3_Module","transfac_public__M00186",3.02,0.0551,"SRF (directAnnotation). ","BCL3 (inferredBy_MotifSimilarity). ",8,1044,"AP1S2;ATF4;CALM1;CFL1;CMTM7;PDLIM7;PFN1;SORBS3"
"DC_Gen3_Module","transfac_pro__M04760",3.02,0.0551,"NR3C1 (directAnnotation). ","BRCA1; CHD2; ETS1; RCOR1; ZBTB33 (inferredBy_MotifSimilarity). ",25,4817,"AMZ2;ATF4;AURKAIP1;BCAP31;CCND3;CFL1;CLEC10A;CPSF3L;CSK;CTSH;DEGS1;ELF4;ERLIN2;ERN1;FAM103A1;FAM89A;GDI2;HSP90B1;MDH2;NDC80;PAQR4;SETD3;SORBS3;THAP7;UBC"
"DC_Gen3_Module","transfac_pro__M01007",3.01,0.0551,"SRF (directAnnotation). ","",3,101,"CFL1;PDLIM7;PFN1"
"DC_Gen3_Module","taipale__Dbp_DBD_NRTTACGTAAYN",3.01,0.055,"DBP (inferredBy_Orthology). ","ATF2; CEBPB; CEBPD; CEBPE; CEBPG; HLF; NFIL3; TEF (inferredBy_MotifSimilarity). CEBPA (inferredBy_MotifSimilarity_n_Orthology). ",4,176,"AP1S2;CALM1;PGK1;SORBS3"
"DC_Gen3_Module","cisbp__M0701",3.01,0.055,"SPDEF (inferredBy_Orthology). ","EHF; ELF2; ELF3; ELF4; ELF5; ETS1; ETV3; ETV6; FLI1 (inferredBy_MotifSimilarity_n_Orthology). ",11,1586,"AURKAIP1;CDC37;CFL1;CSK;ELF4;ERLIN2;PDLIM7;PFN1;PGK1;TTF1;UBC"
"DC_Gen3_Module","cisbp__M5999",3.01,0.055,"DBP (inferredBy_Orthology). ","ATF2; CEBPB; CEBPD; CEBPE; CEBPG; HLF; NFIL3; TEF (inferredBy_MotifSimilarity). CEBPA (inferredBy_MotifSimilarity_n_Orthology). ",4,162,"AP1S2;CALM1;PGK1;SORBS3"
"DC_Gen3_Module","hocomoco__SP1_MOUSE.H11MO.1.A",3.01,0.055,"SP1 (inferredBy_Orthology). ","CTCF; EGR1; EZH2; FOS; IRF1; KLF12; KLF15; KLF16; KLF5; KLF9; NFYA; NFYB; PBX3; SP2; SP3; SP4; STAT1; TEAD2; WT1; ZNF281 (inferredBy_MotifSimilarity). SP6; SP7; SP8; SP9; ZBTB17 (inferredBy_MotifSimilarity_n_Orthology). ",17,3366,"BCAP31;CCND3;CDC37;CFL1;CSK;DNAJA1;ELF4;FAM89A;GDI2;MAD2L2;PDLIM7;PFN1;PHF19;SETD3;SLC9A6;SORBS3;UBC"
"DC_Gen3_Module","hocomoco__SP4_HUMAN.H11MO.1.A",3,0.0549,"SP4 (directAnnotation). ","EGR1; FOS; IRF1; KLF12; KLF15; KLF3; KLF5; KLF6; KLF9; MAZ; NFYA; NFYB; PATZ1; PBX3; SP1; SP2; SP3; STAT1; ZNF148; ZNF281 (inferredBy_MotifSimilarity). KLF17; KLF18; SP5; SP6; SP7; SP8; SP9; ZBTB17 (inferredBy_MotifSimilarity_n_Orthology). ",16,2630,"BCAP31;CALM1;CDC37;CFL1;CSK;DNAJA1;ELF4;ERLIN2;GDI2;MAD2L2;PDIA5;PDLIM7;PFN1;SETD3;SORBS3;UBC"
