"geneSet","motif","NES","AUC","TF_highConf","TF_lowConf","nEnrGenes","rankAtMax","enrichedGenes"
"DC_Gen3_Module","hocomoco__PRD14_HUMAN.H11MO.0.A",3.45,0.0607,"PRDM14 (directAnnotation). ","",3,57,"CALM1;CSK;ELF4"
"DC_Gen3_Module","neph__UW.Motif.0064",3.44,0.0607,"","",5,274,"CALM1;CSK;PGK1;SSU72;UBC"
"DC_Gen3_Module","cisbp__M4951",3.42,0.0604,"FEV (inferredBy_Orthology). ","ELF1; ELF2; ELF4; ELK4; ERF; ERG; ETS1; ETV1; ETV2; FLI1; GABPA (inferredBy_MotifSimilarity). ELK3; ETS2; ETV3; ETV3L (inferredBy_MotifSimilarity_n_Orthology). ",21,4683,"AP1S2;ATF4;AURKAIP1;BCAP31;CCND3;CFL1;CPSF3L;CSK;CTSH;DNAJA1;ELF4;ERLIN2;FAM103A1;FAM89A;GDI2;PDIA5;PFN1;PGK1;SDHC;TTF1;UBC"
"DC_Gen3_Module","taipale_cyt_meth__HSF2_NGAANNTTCYRGAAN_FL_meth",3.41,0.0603,"HSF2 (directAnnotation). ","HOXB2; HSF1; HSF4; PPARGC1A (inferredBy_MotifSimilarity). ",5,353,"CDC37;CSK;DNAJA1;SLC9A6;UBC"
"DC_Gen3_Module","cisbp__M2314",3.41,0.0602,"SP2 (directAnnotation). ","BRF2; CTCF; EGR1; EZH2; FOS; IRF1; KLF12; KLF15; KLF3; KLF5; KLF9; MAZ; NFYA; NFYB; PATZ1; PBX3; SMARCA4; SP1; SP3; SP4; SREBF1; STAT1; SUPT20H (inferredBy_MotifSimilarity). E2F4; SP5; SP6; SP7; SP8; SP9; ZBTB17 (inferredBy_MotifSimilarity_n_Orthology). ",9,793,"BCAP31;CDC37;CFL1;CSK;ELF4;PDLIM7;PFN1;PHF19;SETD3"
"DC_Gen3_Module","cisbp__M5209",3.41,0.0602,"SP6; SP7; SP8; SP9 (inferredBy_Orthology). ","IRF1; KLF10; KLF11; KLF13; KLF14; KLF15; KLF16; KLF4; KLF5; KLF9; SP1; SP2; SP3; SP4 (inferredBy_MotifSimilarity). EGR1; KLF12; KLF17; KLF18; KLF6; KLF7; KLF8 (inferredBy_MotifSimilarity_n_Orthology). ",6,518,"AMZ2;BCAP31;MAD2L2;PDLIM7;PFN1;SETD3"
"DC_Gen3_Module","transfac_pro__M01257",3.4,0.0602,"SRF (directAnnotation). ","",4,116,"CFL1;PDLIM7;PFN1;PGK1"
"DC_Gen3_Module","cisbp__M2247",3.39,0.06,"SP1; SP2; SP3; SP4 (inferredBy_Orthology). ","KLF15; SP6; SP7; SP8; SP9 (inferredBy_MotifSimilarity_n_Orthology). ",22,4681,"AMZ2;ATF4;BCAP31;CCND3;CDC37;CFL1;CSK;DEGS1;DNAJA1;ELF4;ERLIN2;FAM89A;GDI2;HSP90B1;MAD2L2;PDIA5;PDLIM7;PFN1;SETD3;SLC9A6;SORBS3;UBC"
"DC_Gen3_Module","transfac_pro__M06945",3.38,0.0599,"KLF16 (inferredBy_Orthology). ","",25,4734,"ACACA;AP1S2;AURKAIP1;BCAP31;CALM1;CCND3;CDC37;CDV3;CFL1;CSK;DEGS1;ELF4;ERLIN2;HMGCL;HSP90B1;PAQR4;PDIA5;PDLIM7;PFN1;PGLS;PHF19;SETD3;SORBS3;THAP7;TTF1"
"DC_Gen3_Module","predrem__nrMotif2491",3.38,0.0599,"","SP4 (inferredBy_MotifSimilarity). ",4,192,"CALM1;ELF4;FAM89A;SORBS3"
"DC_Gen3_Module","transfac_pro__M04646",3.38,0.0598,"FOXN4 (directAnnotation). ","",20,3931,"ACACA;AMZ2;ATF4;CALM1;CDC37;CSK;CTSH;DNAJA1;ELF4;ERLIN2;ERN1;FAM89A;GDI2;MAD2L2;PDIA5;PFN1;SETD3;SORBS3;SSU72;UBC"
"DC_Gen3_Module","taipale_cyt_meth__HSF2_NGAANNTTCYRGAAN_eDBD_meth",3.38,0.0598,"HSF2 (directAnnotation). ","HOXB2; HSF1; HSF4; HSF5 (inferredBy_MotifSimilarity). ",4,170,"CDC37;CSK;DNAJA1;UBC"
"DC_Gen3_Module","cisbp__M4782",3.38,0.0598,"SP1; SP2; SP3; SP4 (inferredBy_Orthology). ","",8,682,"BCAP31;CDC37;CFL1;ELF4;MAD2L2;PDLIM7;PFN1;SETD3"
"DC_Gen3_Module","cisbp__M0694",3.38,0.0598,"GABPA (inferredBy_Orthology). ","BCLAF1; ELF1; ELK1; ELK3; ELK4; ERF; ERG; ETS1; ETS2; ETV1; ETV2; ETV3; ETV4; ETV5; FEV; FLI1; GABPB1; SRF (inferredBy_MotifSimilarity). ELF2; ELF4; ETV3L; ETV6; ETV7 (inferredBy_MotifSimilarity_n_Orthology). ",23,4735,"AMZ2;AP1S2;ATF4;AURKAIP1;BCAP31;CCND3;CDC37;CFL1;CPSF3L;CSK;DNAJA1;ELF4;ERLIN2;ERN1;FAM89A;GDI2;PDLIM7;PFN1;SDHC;SORBS3;TTF1;UBC;ZDHHC3"
"DC_Gen3_Module","transfac_public__M00169",3.37,0.0598,"HSF1; HSF2; HSF4 (inferredBy_Orthology). ","HOXB2; HSF5 (inferredBy_MotifSimilarity). ",10,1323,"AMZ2;AP1S2;BCAP31;CDC37;DNAJA1;ERLIN2;ERN1;HSP90B1;SLC9A6;UBC"
"DC_Gen3_Module","swissregulon__hs__SRF.p3",3.37,0.0598,"SRF (directAnnotation). ","",3,86,"CFL1;PDLIM7;PFN1"
"DC_Gen3_Module","transfac_pro__M00492",3.36,0.0597,"STAT1 (directAnnotation). ","",5,294,"AURKAIP1;CCND3;CFL1;PDLIM7;PFN1"
"DC_Gen3_Module","flyfactorsurvey__Sp1_SANGER_5_FBgn0020378",3.36,0.0597,"SP6; SP7; SP8; SP9 (inferredBy_Orthology). ","IRF1; KLF10; KLF11; KLF13; KLF14; KLF15; KLF16; KLF4; KLF5; KLF9; SP1; SP2; SP3; SP4 (inferredBy_MotifSimilarity). EGR1; KLF12; KLF17; KLF18; KLF6; KLF7; KLF8 (inferredBy_MotifSimilarity_n_Orthology). ",5,356,"BCAP31;MAD2L2;PDLIM7;PFN1;SETD3"
"DC_Gen3_Module","dbcorrdb__BDP1__ENCSR000DOK_1__m1",3.36,0.0596,"BDP1 (directAnnotation). ","ATF3; BRF1; BRF2; GTF3C2; POLR3A; POLR3G; TBL1XR1; TBP (inferredBy_MotifSimilarity). ",19,3201,"ACACA;AMZ2;CALM1;CCND3;CPSF3L;CSK;DNAJA1;ELF4;ERN1;FAM103A1;GDI2;MAD2L2;MTHFD2;PDIA5;PREB;SORBS3;TTF1;UBC;ZDHHC3"
"DC_Gen3_Module","transfac_pro__M01139",3.36,0.0596,"MAFA (directAnnotation). ","KLRG1 (inferredBy_MotifSimilarity_n_Orthology). ",6,574,"CALM1;CDV3;CSK;ELF4;MAD2L2;SORBS3"
"DC_Gen3_Module","transfac_public__M00435",3.35,0.0594,"","MXI1 (inferredBy_MotifSimilarity). MYC (inferredBy_MotifSimilarity_n_Orthology). ",5,331,"ACACA;AP1S2;CDC37;ELF4;SORBS3"
"DC_Gen3_Module","dbcorrdb__STAT1__ENCSR000DZM_1__m3",3.35,0.0594,"STAT1 (directAnnotation). ","CTCF; FOS; IRF1; KLF12; KLF15; KLF5; MAZ; MXI1; NFYA; NFYB; PBX3; SP1; SP2; SP3; SP4 (inferredBy_MotifSimilarity). CTCFL; SP6; SP7; SP8; SP9 (inferredBy_MotifSimilarity_n_Orthology). ",14,1766,"BCAP31;CDC37;CFL1;ELF4;LOC401052;MAD2L2;MOSPD3;PAQR4;PDLIM7;PFN1;PGLS;PHF19;SETD3;SORBS3"
"DC_Gen3_Module","cisbp__M2863",3.34,0.0594,"","MYC (inferredBy_MotifSimilarity_n_Orthology). ",5,326,"ACACA;AP1S2;CDC37;ELF4;SORBS3"
"DC_Gen3_Module","cisbp__M2443",3.34,0.0593,"HSF1; HSF2; HSF4 (inferredBy_Orthology). ","HOXB2; HSF5 (inferredBy_MotifSimilarity). ",4,96,"CDC37;DNAJA1;HSP90B1;UBC"
"DC_Gen3_Module","flyfactorsurvey__En_Cell_FBgn0000577",3.33,0.0592,"EN1; EN2 (inferredBy_Orthology). ","ALX3; ESX1; GBX2; HESX1; HOXA1; HOXB2; HOXB3; LBX2; MIXL1; PRRX2; RAX (inferredBy_MotifSimilarity). ARX; DLX1; DLX4; DLX6; DRGX; EMX1; EMX2; EVX1; EVX2; GBX1; HOXA2; HOXD3; LHX2; LHX6; LHX8; LHX9; MNX1; NKX1-1; NKX1-2; OTP; PROP1; UNCX; VSX2 (inferredBy_MotifSimilarity_n_Orthology). ",7,729,"ACACA;AP1S2;ARL6IP5;CALM1;CSK;ELF4;ZDHHC3"
"DC_Gen3_Module","cisbp__M2084",3.31,0.059,"","",5,382,"ACACA;AP1S2;ELF4;PGK1;SETD3"
"DC_Gen3_Module","cisbp__M0693",3.31,0.059,"GABPA (inferredBy_Orthology). ","BCLAF1; ELF1; ELF2; ELK1; ELK3; ELK4; ERF; ERG; ETS1; ETS2; ETV1; ETV2; ETV3; ETV4; ETV5; FEV; FLI1; GABPB1; SRF (inferredBy_MotifSimilarity). ELF4; ETV3L; ETV6; ETV7 (inferredBy_MotifSimilarity_n_Orthology). ",21,4245,"AMZ2;AP1S2;ATF4;AURKAIP1;BCAP31;CCND3;CDC37;CFL1;CPSF3L;CSK;DNAJA1;ERLIN2;FAM89A;GDI2;PDLIM7;PFN1;SDHC;SORBS3;TTF1;UBC;ZDHHC3"
"DC_Gen3_Module","dbcorrdb__BRCA1__ENCSR000DZS_1__m1",3.3,0.0589,"BRCA1 (directAnnotation). ","CHD2; ETS1; NR3C1; RCOR1; ZBTB33 (inferredBy_MotifSimilarity). ",24,4994,"AMZ2;ATF4;CALM1;CDCA4;CDV3;CFL1;CLEC10A;CPSF3L;CSK;CTSH;DNAJA1;ELF4;ERLIN2;ERN1;FAM103A1;FAM89A;GDI2;MDH2;PDIA5;PHF19;SORBS3;SSU72;THAP7;UBC"
"DC_Gen3_Module","transfac_pro__M01273",3.3,0.0588,"SP4 (directAnnotation). ","CTCF; EGR1; ESRRA; EZH2; FOS; IRF1; KLF12; KLF15; KLF16; KLF5; MXI1; NFYB; PBX3; POLR2A; SMARCA4; SP1; SP2; SP3; WT1 (inferredBy_MotifSimilarity). ",24,4914,"ACACA;AMZ2;AP1S2;BCAP31;CALM1;CCND3;CDC37;CFL1;CSK;DNAJA1;ELF4;ERLIN2;ERN1;FAM89A;GDI2;MAD2L2;PDIA5;PDLIM7;PFN1;SDHC;SETD3;SLC9A6;SORBS3;UBC"
"DC_Gen3_Module","transfac_pro__M09237",3.29,0.0587,"","HOXB2; HSF1; HSF2; HSF4 (inferredBy_MotifSimilarity). ",4,140,"CDC37;DNAJA1;HSP90B1;UBC"
"DC_Gen3_Module","taipale_cyt_meth__ZNF524_NYTCGNACCCRN_FL_meth",3.29,0.0587,"ZNF524 (directAnnotation). ","",5,431,"CMTM7;CSK;ELF4;ERN1;UBC"
"DC_Gen3_Module","predrem__nrMotif2231",3.28,0.0586,"","",5,363,"AMZ2;CSK;ELF4;TTF1;UBC"
"DC_Gen3_Module","cisbp__M4617",3.28,0.0586,"ELF1 (directAnnotation). ","EGR1; EHF; ELF2; ELF3; ELF4; ELF5; ELK1; ELK3; ELK4; ETV6; GABPA; GABPB1; NR2C2; POLR2A; SIN3A; SRF (inferredBy_MotifSimilarity). ERF; ETV3; ETV3L (inferredBy_MotifSimilarity_n_Orthology). ",4,178,"AP1S2;AURKAIP1;PFN1;TTF1"
"DC_Gen3_Module","transfac_pro__M01837",3.28,0.0586,"KLF11 (directAnnotation). ","",5,353,"CFL1;CSK;ELF4;PDLIM7;PFN1"
"DC_Gen3_Module","flyfactorsurvey__btd_NAR_FBgn0000233",3.27,0.0584,"SP1; SP2; SP3; SP4 (inferredBy_Orthology). ","",21,4393,"AMZ2;ATF4;BCAP31;CCND3;CDC37;CDV3;CFL1;CSK;DNAJA1;ELF4;ERLIN2;FAM89A;GDI2;HSP90B1;MAD2L2;PDIA5;PDLIM7;PFN1;SETD3;SORBS3;UBC"
"DC_Gen3_Module","swissregulon__hs__VSX1_2.p2",3.27,0.0584,"VSX1; VSX2 (directAnnotation). ","HOXD8 (inferredBy_MotifSimilarity). ",6,513,"ACACA;AP1S2;CSK;ELF4;THAP7;ZDHHC3"
"DC_Gen3_Module","cisbp__M5399",3.26,0.0583,"ERG (directAnnotation). ","EGR1; ELF1; ELK1; ELK3; ELK4; ERF; ETS1; ETS2; ETV1; ETV2; ETV3; ETV4; ETV5; FEV; FLI1; GABPA; GABPB1; SRF (inferredBy_MotifSimilarity). ETV3L; ETV6; ETV7 (inferredBy_MotifSimilarity_n_Orthology). ",5,332,"AURKAIP1;CFL1;CSK;PFN1;TTF1"
"DC_Gen3_Module","homer__AACCGGAAGT_ELF1",3.26,0.0583,"ELF1 (directAnnotation). ","BCLAF1; EHF; ELF2; ELF3; ELF4; ELF5; ELK1; ELK3; ELK4; EP300; ERG; ETS2; ETV1; ETV4; ETV6; FEV; FLI1; GABPA; GABPB1; SRF (inferredBy_MotifSimilarity). ERF; ETS1; ETV3; ETV3L; ETV5; ETV7 (inferredBy_MotifSimilarity_n_Orthology). ",4,178,"AP1S2;AURKAIP1;PFN1;TTF1"
"DC_Gen3_Module","transfac_pro__M09189",3.26,0.0583,"","SOX3 (inferredBy_MotifSimilarity_n_Orthology). ",7,793,"ACACA;CALM1;CCND3;ELF4;ERN1;NDC80;SSU72"
"DC_Gen3_Module","cisbp__M4943",3.26,0.0582,"EN1; EN2 (inferredBy_Orthology). ","ALX3; ESX1; GBX2; HESX1; HOXA1; HOXB2; HOXB3; LBX2; MIXL1; PRRX2; RAX (inferredBy_MotifSimilarity). ARX; DLX1; DLX4; DLX6; DRGX; EMX1; EMX2; EVX1; EVX2; GBX1; HOXA2; HOXD3; LHX2; LHX6; LHX8; LHX9; MNX1; NKX1-1; NKX1-2; OTP; PROP1; UNCX; VSX2 (inferredBy_MotifSimilarity_n_Orthology). ",5,333,"AP1S2;CALM1;CSK;ELF4;ZDHHC3"
"DC_Gen3_Module","cisbp__M0709",3.25,0.0582,"ERG (inferredBy_Orthology). ","BCLAF1; ELF1; ELF2; ELK1; ELK3; ELK4; ERF; ETS1; ETS2; ETV1; ETV2; ETV3; ETV4; ETV5; ETV6; FEV; FLI1; GABPA; GABPB1; SRF (inferredBy_MotifSimilarity). ELF4; ETV3L; ETV7 (inferredBy_MotifSimilarity_n_Orthology). ",10,1537,"AP1S2;AURKAIP1;CDC37;CFL1;CSK;ERLIN2;PDLIM7;PFN1;TTF1;UBC"
"DC_Gen3_Module","cisbp__M0699",3.25,0.0582,"FLI1 (inferredBy_Orthology). ","BCLAF1; ELF1; ELK1; ELK3; ELK4; ERF; ERG; ETS1; ETS2; ETV1; ETV2; ETV3; ETV4; ETV5; ETV6; FEV; GABPA; SRF (inferredBy_MotifSimilarity). ELF2; ELF4; ETV3L; ETV7; SPDEF (inferredBy_MotifSimilarity_n_Orthology). ",10,1526,"AP1S2;AURKAIP1;CDC37;CFL1;CSK;ERLIN2;PDLIM7;PFN1;TTF1;UBC"
"DC_Gen3_Module","cisbp__M0710",3.25,0.0581,"","BCLAF1; ELF1; ELF2; ELF4; ELK1; ELK3; ELK4; ERF; ERG; ETS1; ETS2; ETV1; ETV2; ETV3; ETV4; ETV5; FEV; FLI1; GABPA; GABPB1; SRF (inferredBy_MotifSimilarity). ETV3L; ETV6; ETV7 (inferredBy_MotifSimilarity_n_Orthology). ",14,2137,"AP1S2;ATF4;AURKAIP1;BCAP31;CDC37;CFL1;CPSF3L;CSK;FAM89A;PDLIM7;PFN1;SDHC;TTF1;UBC"
"DC_Gen3_Module","homer__GGCCCCGCCCCC_Sp1",3.24,0.0581,"","EGR1; ESRRA; EZH2; FOS; IRF1; KLF12; KLF14; KLF15; KLF16; KLF3; KLF5; KLF9; NFYA; NFYB; PATZ1; PBX3; SP1; SP2; SP3; SP4; STAT1; TEAD2 (inferredBy_MotifSimilarity). KLF17; KLF18; SP6; SP7; SP8; SP9 (inferredBy_MotifSimilarity_n_Orthology). ",20,3654,"ACACA;AMZ2;ARL6IP5;BCAP31;CDC37;CFL1;CSK;DEGS1;ELF4;ERN1;LOC401052;MAD2L2;MOSPD3;PAQR4;PARD6A;PDLIM7;PFN1;PHF19;SETD3;ZFPL1"
"DC_Gen3_Module","transfac_pro__M07100",3.24,0.058,"HSF1 (directAnnotation). ","HOXB2; HSF2; HSF4 (inferredBy_MotifSimilarity). ",3,102,"CDC37;DNAJA1;UBC"
"DC_Gen3_Module","cisbp__M0692",3.23,0.0579,"ELK3 (inferredBy_Orthology). ","BCLAF1; ELF1; ELF2; ELF4; ELK1; ELK4; ERF; ERG; ETS1; ETS2; ETV1; ETV2; ETV3; ETV4; ETV5; ETV6; FEV; FLI1; GABPA; GABPB1; PML; SRF; TAF1 (inferredBy_MotifSimilarity). ETV3L; ETV7 (inferredBy_MotifSimilarity_n_Orthology). ",22,3699,"AMZ2;AP1S2;ATF4;AURKAIP1;BCAP31;CCND3;CDC37;CFL1;CPSF3L;CSK;DNAJA1;ELF4;ERLIN2;FAM103A1;FAM89A;GDI2;PDLIM7;PFN1;SDHC;TATDN3;TTF1;UBC"
"DC_Gen3_Module","taipale_tf_pairs__ETV5_EVX1_RSCGGWAATKR_CAP",3.23,0.0579,"ETV5; EVX1 (directAnnotation). ","",5,396,"AURKAIP1;CFL1;CSK;PFN1;TTF1"
"DC_Gen3_Module","cisbp__M0702",3.23,0.0579,"SPDEF (inferredBy_Orthology). ","",6,488,"AURKAIP1;CDC37;CFL1;CSK;TTF1;UBC"
"DC_Gen3_Module","dbcorrdb__BRF1__ENCSR000DOJ_1__m1",3.23,0.0579,"BRF1 (directAnnotation). ","ATF3; BDP1; BRF2; GTF3C2; POLR3A; POLR3G; TBL1XR1; TBP (inferredBy_MotifSimilarity). ",20,3366,"ACACA;AMZ2;CALM1;CCND3;CSK;CTSH;DNAJA1;ELF4;ERN1;FAM103A1;GDI2;HMGCL;HSP90B1;MAD2L2;MTHFD2;PDIA5;SORBS3;TTF1;UBC;ZDHHC3"
"DC_Gen3_Module","cisbp__M3960",3.22,0.0578,"SRF (directAnnotation). ","BCL3 (inferredBy_MotifSimilarity). ",6,488,"AP1S2;ATF4;CFL1;CMTM7;PFN1;SORBS3"
"DC_Gen3_Module","scertf__pachkov.HSF1",3.22,0.0578,"HSF1; HSF2; HSF4 (inferredBy_Orthology). ","HOXB2 (inferredBy_MotifSimilarity). ",3,71,"CDC37;DNAJA1;UBC"
"DC_Gen3_Module","taipale_cyt_meth__DBP_NRTTAYGTAAYN_FL",3.22,0.0578,"DBP (directAnnotation). ","ATF2; CEBPB; CEBPD; CEBPE; CEBPG; CREB1; CREB5; CREM; HLF; NFIL3; TEF (inferredBy_MotifSimilarity). ",4,235,"AP1S2;CALM1;PGK1;SORBS3"
"DC_Gen3_Module","dbcorrdb__ELK4__ENCSR000EVI_1__m1",3.22,0.0578,"ELK4 (directAnnotation). ","BCLAF1; BRF1; CTCF; E2F4; E2F6; EGR1; ELF1; ELF2; ELF4; ELK1; ELK3; ERF; ERG; ETS1; ETS2; ETV1; ETV2; ETV3; ETV4; ETV5; EZH2; FEV; FLI1; GABPA; GABPB1; HCFC1; HDAC2; MAX; MAZ; MXI1; MYC; NELFE; PHF8; PML; POLR2A; RBBP5; SIN3A; SMARCA4; SREBF1; SRF; TAF1; XRCC4; ZMIZ1; ZNF143 (inferredBy_MotifSimilarity). ETV3L; ETV6; ETV7 (inferredBy_MotifSimilarity_n_Orthology). ",7,755,"AP1S2;ATF4;AURKAIP1;CFL1;CSK;PFN1;TTF1"
"DC_Gen3_Module","flyfactorsurvey__Ets96B_SANGER_5_FBgn0039225",3.22,0.0578,"ETV1; ETV4; ETV5 (inferredBy_Orthology). ","BCLAF1; ELF1; ELF2; ELK1; ELK3; ELK4; ERF; ERG; ETS1; ETS2; ETV2; ETV3; FEV; FLI1; GABPA; GABPB1; SRF (inferredBy_MotifSimilarity). ETV3L; ETV6; ETV7 (inferredBy_MotifSimilarity_n_Orthology). ",8,661,"AP1S2;ATF4;AURKAIP1;CFL1;CSK;ERN1;PFN1;TTF1"
"DC_Gen3_Module","hocomoco__SP1_HUMAN.H11MO.1.A",3.21,0.0577,"SP1 (directAnnotation). ","BRF1; BRF2; CTCF; EGR1; ESRRA; EZH2; FOS; IRF1; KLF12; KLF14; KLF15; KLF16; KLF3; KLF5; KLF6; KLF9; MAZ; NELFE; NFYA; NFYB; PATZ1; PBX3; POLR2A; SMARCA4; SP2; SP3; SP4; SP9; STAT1 (inferredBy_MotifSimilarity). KLF17; KLF18; SP6; SP7; SP8 (inferredBy_MotifSimilarity_n_Orthology). ",25,4914,"ACACA;AMZ2;BCAP31;CCND3;CDC37;CDV3;CFL1;CSK;DEGS1;DNAJA1;ELF4;ERLIN2;ERN1;FAM89A;LOC401052;MAD2L2;MOSPD3;PAQR4;PARD6A;PDLIM7;PFN1;PHF19;SDHC;SETD3;ZFPL1"
"DC_Gen3_Module","jaspar__MA0279.1",3.21,0.0576,"","",5,465,"ACACA;AP1S2;ELF4;PGK1;SETD3"
"DC_Gen3_Module","jaspar__MA0079.3",3.2,0.0575,"SP1 (directAnnotation). ","EGR1; FOS; IRF1; KLF12; KLF15; KLF16; KLF3; KLF5; KLF6; MAZ; NFYA; NFYB; PATZ1; PBX3; SP2; SP3; SP4; STAT1; TEAD2; WT1; ZNF281 (inferredBy_MotifSimilarity). E2F4; SP6; SP7; SP8; SP9; ZBTB17 (inferredBy_MotifSimilarity_n_Orthology). ",17,3035,"BCAP31;CCND3;CDC37;CDV3;CFL1;CSK;DNAJA1;ELF4;MAD2L2;PDIA5;PDLIM7;PFN1;PHF19;SETD3;SLC9A6;SORBS3;UBC"
"DC_Gen3_Module","transfac_pro__M09404",3.2,0.0575,"","HOXB2; HSF1; HSF2; HSF4 (inferredBy_MotifSimilarity). ",4,124,"CDC37;DNAJA1;HSP90B1;UBC"
"DC_Gen3_Module","jaspar__MA0599.1",3.2,0.0575,"KLF5 (directAnnotation). ","IRF1; KLF1; KLF10; KLF11; KLF12; KLF13; KLF15; KLF16; KLF17; KLF2; KLF3; KLF4; KLF6; KLF7; KLF8; KLF9; SP1; SP2; SP3; SP4 (inferredBy_MotifSimilarity). SP6; SP7; SP8; SP9 (inferredBy_MotifSimilarity_n_Orthology). ",4,126,"BCAP31;CDC37;PDLIM7;PFN1"
"DC_Gen3_Module","cisbp__M4453",3.2,0.0575,"BCL11A (directAnnotation). ","EP300; IKZF1; IRF4; IRF8; MTA3; PAX5; RELA; SPI1; SPIB; STAT3; TBL1XR1 (inferredBy_MotifSimilarity). IRF1 (inferredBy_MotifSimilarity_n_Orthology). ",5,396,"ACACA;CCND3;ELF4;PDLIM7;SORBS3"
"DC_Gen3_Module","cisbp__M5425",3.17,0.0572,"ETV6 (directAnnotation). ","BCLAF1; ELF1; ELF2; ELF5; ELK1; ELK3; ELK4; ERF; ERG; ETS1; ETV1; ETV2; ETV3; ETV4; ETV5; FEV; FLI1; GABPA; HCFC1; IRF1; PHF8; PML; POLR2A; RELA; TAF1 (inferredBy_MotifSimilarity). ELF4; ETS2 (inferredBy_MotifSimilarity_n_Orthology). ",17,3232,"ACACA;AMZ2;BCAP31;CDC37;CSK;CTSH;ELF4;FAM103A1;FAM89A;GDI2;MAD2L2;PDLIM7;PFN1;SORBS3;TTF1;UBC;VPS37A"
"DC_Gen3_Module","homer__NNTTCTGGAANNTTCTAGAA_HRE",3.17,0.0571,"HSF1 (directAnnotation). ","HOXB2; HSF2; HSF4 (inferredBy_MotifSimilarity). ",4,199,"CDC37;CSK;DNAJA1;UBC"
"DC_Gen3_Module","transfac_pro__M06948",3.17,0.0571,"SP2 (directAnnotation). ","",19,3751,"AP1S2;AURKAIP1;CDC37;CDV3;CFL1;CSK;DEGS1;ELF4;ERLIN2;FAM89A;HMGCL;PAQR4;PDIA5;PFN1;PGLS;PHF19;SLC9A6;SORBS3;TTF1"
"DC_Gen3_Module","cisbp__M0703",3.16,0.057,"ELK4 (inferredBy_Orthology). ","BCLAF1; ELF1; ELK1; ELK3; ERF; ERG; ETS1; ETS2; ETV1; ETV2; ETV3; ETV4; ETV5; FEV; FLI1; GABPA; SRF (inferredBy_MotifSimilarity). ELF2; ELF4; ETV3L; ETV6; ETV7 (inferredBy_MotifSimilarity_n_Orthology). ",22,4276,"AMZ2;AP1S2;ATF4;AURKAIP1;BCAP31;CDC37;CFL1;CPSF3L;CSK;DNAJA1;ELF4;ERLIN2;ERN1;FAM89A;GDI2;PDLIM7;PFN1;PGK1;SDHC;TATDN3;TTF1;UBC"
"DC_Gen3_Module","cisbp__M1906",3.15,0.0569,"SP1 (directAnnotation). ","EGR1; FOS; IRF1; KLF12; KLF15; KLF16; KLF3; KLF5; KLF6; MAZ; NFYA; NFYB; PATZ1; PBX3; SP2; SP3; SP4; STAT1; TEAD2; WT1; ZNF281 (inferredBy_MotifSimilarity). E2F4; SP6; SP7; SP8; SP9; ZBTB17 (inferredBy_MotifSimilarity_n_Orthology). ",14,2137,"BCAP31;CCND3;CDC37;CDV3;CFL1;CSK;DNAJA1;ELF4;MAD2L2;PDLIM7;PFN1;SETD3;SORBS3;UBC"
"DC_Gen3_Module","cisbp__M4462",3.15,0.0569,"GABPA (directAnnotation). ","BCLAF1; EGR1; ELF1; ELF2; ELF4; ELK1; ELK3; ELK4; EP300; ERF; ERG; ETS1; ETS2; ETV1; ETV2; ETV3; ETV4; ETV5; ETV6; FEV; FLI1; GABPB1; HCFC1; PHF8; PML; POLR2A; SIN3A; SRF; TAF1 (inferredBy_MotifSimilarity). ETV3L; ETV7 (inferredBy_MotifSimilarity_n_Orthology). ",4,184,"AP1S2;AURKAIP1;PFN1;TTF1"
"DC_Gen3_Module","dbcorrdb__POLR2A__ENCSR000EHP_1__m1",3.15,0.0569,"POLR2A (directAnnotation). ","BCLAF1; BRF1; CREB1; E2F6; ELF1; ELF2; ELK1; ELK3; ELK4; ETS1; ETV1; ETV5; ETV6; EZH2; GABPA; GABPB1; GTF2F1; HCFC1; MXI1; NR2C2; PHF8; PML; SIN3A; TAF1; XRCC4; ZNF143; ZNF274 (inferredBy_MotifSimilarity). FLI1 (inferredBy_MotifSimilarity_n_Orthology). ",14,2151,"AMZ2;AP1S2;ATF4;AURKAIP1;BCAP31;CFL1;CSK;ELF4;FAM103A1;MOSPD3;NFKBIB;PFN1;TTF1;UBC"
"DC_Gen3_Module","predrem__nrMotif1049",3.14,0.0568,"","",17,3368,"ACACA;AMZ2;AP1S2;ARL6IP5;BCAP31;CALM1;CDC37;CSK;ELF4;ERLIN2;FAM89A;MAD2L2;PFN1;PGK1;SETD3;SORBS3;UBC"
"DC_Gen3_Module","homer__AACCGGAAGT_GABPA",3.14,0.0568,"GABPA (directAnnotation). ","BCLAF1; ELF1; ELF2; ELF4; ELK1; ELK3; ELK4; ERF; ERG; ETS1; ETS2; ETV1; ETV2; ETV3; ETV4; ETV5; FEV; FLI1; GABPB1; RELA; SRF (inferredBy_MotifSimilarity). ETV3L; ETV6; ETV7 (inferredBy_MotifSimilarity_n_Orthology). ",5,317,"AURKAIP1;CFL1;CSK;PFN1;TTF1"
"DC_Gen3_Module","cisbp__M0472",3.14,0.0568,"","",7,648,"CCND3;CDC37;CSK;ELF4;PDLIM7;SORBS3;UBC"
"DC_Gen3_Module","cisbp__M2292",3.14,0.0567,"JUND (directAnnotation). ","ATF3; EP300; FOS; FOSB; FOSL1; FOSL2; JDP2; JUN; JUNB; MEF2C; MYC; NFE2; RCOR1; SMARCC1; STAT3; TCF12; TCF7L2; TRIM28 (inferredBy_MotifSimilarity). BATF (inferredBy_MotifSimilarity_n_Orthology). ",8,793,"ARL6IP5;CALM1;CTSH;ELF4;PFN1;SLC9A6;UBC;ZDHHC3"
"DC_Gen3_Module","jaspar__MA0443.1",3.14,0.0567,"SP1; SP2; SP3; SP4 (inferredBy_Orthology). ","KLF15; SP6; SP7; SP8; SP9 (inferredBy_MotifSimilarity_n_Orthology). ",22,4694,"AMZ2;ATF4;BCAP31;CCND3;CDC37;CDV3;CFL1;CSK;DEGS1;DNAJA1;ELF4;ERLIN2;FAM89A;GDI2;HSP90B1;MAD2L2;PDIA5;PDLIM7;PFN1;SETD3;SORBS3;UBC"
"DC_Gen3_Module","cisbp__M5746",3.14,0.0567,"POU6F2 (directAnnotation). ","POU6F1 (inferredBy_MotifSimilarity). ",4,188,"AP1S2;CSK;ELF4;ERLIN2"
"DC_Gen3_Module","taipale_cyt_meth__RHOXF1_NGGATCAN_FL_meth",3.14,0.0567,"RHOXF1 (directAnnotation). ","",5,339,"CALM1;CTSH;ELF4;PAQR4;SSU72"
"DC_Gen3_Module","taipale_cyt_meth__PAX4_NYACGCTAATTAN_eDBD",3.13,0.0567,"PAX4 (directAnnotation). ","EMX1; ESX1; GSX2; LHX4; PAX3; PAX7 (inferredBy_MotifSimilarity). EMX2; GSX1; HOXA1; LHX2; LHX6; LHX8; LHX9; NOTO; VAX1; VAX2 (inferredBy_MotifSimilarity_n_Orthology). ",6,492,"ACACA;ARL6IP5;CALM1;CSK;ELF4;PHF19"
"DC_Gen3_Module","swissregulon__hs__NFIL3.p2",3.13,0.0566,"NFIL3 (directAnnotation). ","",5,262,"AP1S2;CALM1;PGK1;PHF19;SORBS3"
"DC_Gen3_Module","taipale__TEF_DBD_NRTTACRTAAYN",3.13,0.0566,"TEF (directAnnotation). ","ATF2; CEBPB; CEBPD; CEBPE; CEBPG; DBP; HLF; NFIL3 (inferredBy_MotifSimilarity). CEBPA (inferredBy_MotifSimilarity_n_Orthology). ",4,176,"AP1S2;CALM1;PGK1;SORBS3"
"DC_Gen3_Module","cisbp__M4684",3.13,0.0566,"ATF3 (directAnnotation). ","BACH1; BACH2; BATF; EP300; FOS; FOSB; FOSL1; FOSL2; JDP2; JUN; JUNB; JUND; MEF2C; MYC; NFE2; TCF7L2; TRIM28 (inferredBy_MotifSimilarity). ",5,299,"ELF4;PFN1;SLC9A6;UBC;ZDHHC3"
"DC_Gen3_Module","dbcorrdb__MAZ__ENCSR000DZA_1__m1",3.12,0.0565,"MAZ (directAnnotation). ","BRF1; BRF2; CEBPB; CTCF; EGR1; ESRRA; EZH2; HDAC2; KLF16; KLF3; KLF6; MXI1; MYC; NELFE; POLR2A; RAD21; RBBP5; RCOR1; SMARCA4; SP1; SP2; SP3; SP4; SREBF1; SREBF2; SUPT20H; XRCC4; ZMIZ1; ZNF274 (inferredBy_MotifSimilarity). ",6,428,"CDC37;CFL1;ELF4;PDLIM7;PFN1;SETD3"
"DC_Gen3_Module","hocomoco__CR3L1_HUMAN.H11MO.0.D",3.11,0.0564,"CREB3L1 (directAnnotation). ","ATF6B; CREB3; CREB3L4 (inferredBy_MotifSimilarity). ATF6; CLOCK; CREB3L2 (inferredBy_MotifSimilarity_n_Orthology). ",4,241,"ATF4;MTHFD2;PDIA5;ZFPL1"
"DC_Gen3_Module","transfac_pro__M05157",3.11,0.0563,"","",4,186,"AP1S2;CDC37;CSK;FAM89A"
"DC_Gen3_Module","elemento__GCCAAGGC",3.1,0.0562,"","",14,2331,"ACACA;CALM1;CDV3;CSK;DNAJA1;ELF4;ERLIN2;ERN1;FAM103A1;FAM89A;MAD2L2;NFKBIB;SDHC;SORBS3"
"DC_Gen3_Module","cisbp__M0707",3.1,0.0562,"ETS1 (inferredBy_Orthology). ","BCLAF1; ELF1; ELF2; ELK1; ELK3; ELK4; ERF; ERG; ETS2; ETV1; ETV2; ETV3; ETV4; ETV5; ETV6; FEV; FLI1; GABPA; GABPB1; SRF (inferredBy_MotifSimilarity). EHF; ELF3; ELF4; ETV3L; ETV7; SPDEF (inferredBy_MotifSimilarity_n_Orthology). ",4,159,"AURKAIP1;CFL1;PFN1;TTF1"
"DC_Gen3_Module","swissregulon__hs__TBP.p2",3.1,0.0562,"TBP (directAnnotation). ","GTF2B; GTF2F1; POLR2A; TAF1 (inferredBy_MotifSimilarity). TBPL2 (inferredBy_MotifSimilarity_n_Orthology). ",4,154,"ATF4;CALM1;PDLIM7;UBC"
"DC_Gen3_Module","swissregulon__hs__NRF1.p2",3.1,0.0562,"NRF1 (directAnnotation). ","EGR1 (inferredBy_MotifSimilarity). ",14,2515,"AMZ2;CDC37;CDV3;CFL1;CSK;DNAJA1;ELF4;PAQR4;PDIA5;PFN1;PGLS;PREB;THAP7;UBC"
"DC_Gen3_Module","transfac_pro__M05150",3.09,0.0561,"","",4,189,"CALM1;FAM89A;PDIA5;PDLIM7"
"DC_Gen3_Module","transfac_pro__M06372",3.09,0.056,"ZNF841 (directAnnotation). ","",4,133,"ACACA;AMZ2;ELF4;SORBS3"
"DC_Gen3_Module","flyfactorsurvey__Ets97D_SANGER_10_FBgn0004510",3.08,0.056,"ERG (inferredBy_Orthology). ","BCLAF1; ELF1; ELK1; ELK3; ELK4; ERF; ETS1; ETS2; ETV1; ETV2; ETV3; ETV4; ETV5; FEV; FLI1; GABPA; GABPB1; SRF (inferredBy_MotifSimilarity). ELF2; ELF4; ETV3L; ETV6; ETV7 (inferredBy_MotifSimilarity_n_Orthology). ",8,760,"AP1S2;ATF4;AURKAIP1;BCAP31;CFL1;CSK;PFN1;TTF1"
"DC_Gen3_Module","taipale_tf_pairs__ETV5_HOXA2_RSCGGWAATKR_CAP",3.08,0.056,"ETV5; HOXA2 (directAnnotation). ","",5,398,"AURKAIP1;CFL1;CSK;PFN1;TTF1"
"DC_Gen3_Module","dbcorrdb__TBP__ENCSR000EEL_1__m2",3.07,0.0558,"TBP (directAnnotation). ","",20,4393,"ACACA;CALM1;CMTM7;CSK;DNAJA1;ELF4;ERLIN2;ERN1;FAM89A;MAD2L2;MOSPD3;NFKBIB;PFN1;PGLS;PHF19;SDHC;SETD3;SLC9A6;SSU72;UBC"
"DC_Gen3_Module","taipale_cyt_meth__ETV1_NACCGGAWGTN_eDBD",3.07,0.0558,"ETV1 (directAnnotation). ","BCLAF1; ELF1; ELK1; ELK3; ELK4; ERF; ERG; ETS1; ETS2; ETV2; ETV3; ETV4; ETV5; FEV; FLI1; GABPA; GABPB1; POLR2A; SRF; TAF1 (inferredBy_MotifSimilarity). ETV3L; ETV6; ETV7 (inferredBy_MotifSimilarity_n_Orthology). ",20,4315,"AMZ2;AP1S2;ATF4;AURKAIP1;BCAP31;CDC37;CFL1;CPSF3L;CSK;DNAJA1;ELF4;ERN1;FAM103A1;FAM89A;PDLIM7;PFN1;PGK1;TATDN3;TTF1;UBC"
"DC_Gen3_Module","taipale__POU6F2_DBD_NSCTMATTAN_repr",3.07,0.0558,"POU6F2 (directAnnotation). ","POU6F1 (inferredBy_MotifSimilarity). ",5,428,"AP1S2;CSK;ELF4;ERLIN2;PDIA5"
"DC_Gen3_Module","taipale_cyt_meth__ELK4_NRCCGGAWGTN_FL",3.07,0.0558,"ELK4 (directAnnotation). ","BCLAF1; ELF1; ELF2; ELK1; ELK3; ERF; ERG; ETS1; ETS2; ETV1; ETV2; ETV3; ETV4; ETV5; FEV; FLI1; GABPA; GABPB1; HCFC1; POLR2A; SRF; TAF1 (inferredBy_MotifSimilarity). ETV3L; ETV6; ETV7 (inferredBy_MotifSimilarity_n_Orthology). ",12,1593,"AMZ2;AP1S2;ATF4;AURKAIP1;BCAP31;CFL1;CPSF3L;CSK;FAM89A;PDLIM7;PFN1;TTF1"
"DC_Gen3_Module","cisbp__M0700",3.07,0.0557,"ETV4 (inferredBy_Orthology). ","BCLAF1; ELF1; ELF2; ELF4; ELK1; ELK3; ELK4; ERF; ERG; ETS1; ETS2; ETV1; ETV2; ETV3; ETV5; FEV; FLI1; GABPA; GABPB1; POLR2A; SRF (inferredBy_MotifSimilarity). ETV3L; ETV6; ETV7 (inferredBy_MotifSimilarity_n_Orthology). ",23,4315,"AMZ2;AP1S2;ATF4;AURKAIP1;BCAP31;CCND3;CDC37;CFL1;CPSF3L;CSK;DNAJA1;ELF4;ERLIN2;ERN1;FAM89A;GDI2;PDLIM7;PFN1;PGK1;SDHC;TTF1;UBC;ZDHHC3"
"DC_Gen3_Module","taipale__FLI1_DBD_ACCGGAARYN",3.06,0.0557,"FLI1 (directAnnotation). ","BCLAF1; ELF1; ELK1; ELK3; ELK4; ERF; ERG; ETS1; ETS2; ETV1; ETV2; ETV3; ETV4; ETV5; FEV; GABPA; GABPB1; SRF (inferredBy_MotifSimilarity). ETV3L; ETV6; ETV7 (inferredBy_MotifSimilarity_n_Orthology). ",11,1531,"AP1S2;ATF4;AURKAIP1;BCAP31;CDC37;CFL1;CPSF3L;CSK;PDLIM7;PFN1;TTF1"
"DC_Gen3_Module","cisbp__M2391",3.06,0.0557,"KLF5 (directAnnotation). ","FOS; IRF1; KLF1; KLF10; KLF11; KLF12; KLF13; KLF15; KLF16; KLF17; KLF2; KLF3; KLF4; KLF6; KLF7; KLF8; KLF9; PBX3; SP1; SP2; SP3; SP4 (inferredBy_MotifSimilarity). SP6; SP7; SP8; SP9 (inferredBy_MotifSimilarity_n_Orthology). ",4,157,"BCAP31;CDC37;PDLIM7;PFN1"
"DC_Gen3_Module","cisbp__M5418",3.06,0.0556,"ETS1 (directAnnotation). ","ELF1; ELF4; ELK1; ELK3; ELK4; ERF; ERG; ETS2; ETV1; ETV2; ETV3; ETV4; ETV5; ETV6; FEV; FLI1; GABPA; GABPB1; SRF (inferredBy_MotifSimilarity). ELF2; ETV3L; ETV7 (inferredBy_MotifSimilarity_n_Orthology). ",10,1146,"AP1S2;ATF4;AURKAIP1;BCAP31;CDC37;CFL1;CPSF3L;CSK;PFN1;TTF1"
"DC_Gen3_Module","dbcorrdb__POLR2A__ENCSR000EAM_1__m1",3.06,0.0556,"POLR2A (directAnnotation). ","BCLAF1; BRF1; CREB1; E2F6; ELF1; ELK4; ESRRA; ETS1; EZH2; GABPA; GTF2F1; HCFC1; MAX; MXI1; MYC; NR2C2; PHF8; PML; RBBP5; SIN3A; SMARCA4; SREBF1; TAF1; XRCC4; ZMIZ1; ZNF143; ZNF274 (inferredBy_MotifSimilarity). FLI1 (inferredBy_MotifSimilarity_n_Orthology). ",13,2000,"AMZ2;AP1S2;ATF4;AURKAIP1;BCAP31;CDC37;CFL1;CSK;FAM103A1;MOSPD3;NFKBIB;PFN1;TTF1"
